url,title,category
https://dzone.com/articles/using-the-cloud-as-a-sandbox-for-server-consolidat,"Using the Cloud as a Sandbox for Server Consolidation",Cloud
https://dzone.com/articles/industry-cloud-is-the-future-of-cloud-transformati,"Industry Cloud Is The Future Of Cloud Transformation and Realization",Cloud
https://dzone.com/articles/test-environments-why-test-in-the-cloud,"Test Environments: Why Test in the Cloud?",Cloud
https://dzone.com/articles/cloudhub-dedicated-load-balancer-advanced-concepts-mapping-rules,"CloudHub Dedicated Load Balancer Advanced Concepts: Mapping Rules",Cloud
https://dzone.com/articles/get-aws-monthly-cost-using-ps-script-1,"Get AWS Monthly Cost Using PS Script",Cloud
https://dzone.com/articles/laas-paas-caas-iaas-faas-and-saas-1,"Understanding LaaS, PaaS, CaaS, IaaS, FaaS, and SaaS",Cloud
https://dzone.com/articles/are-solution-architects-relevant-in-post-covid-tim,"Are Solution Architects Relevant In Post-Covid Time?",Cloud
https://dzone.com/articles/multiple-ways-to-invoke-aws-lambda-functions,"Multiple Ways to Invoke AWS Lambda Functions",Cloud
https://dzone.com/articles/debugging-in-production-how-to-move-fast-without-b,"Debugging in Production - How To Move Fast Without Breaking Things",Cloud
https://dzone.com/articles/kubernetes-the-ultimate-platform-for-containerized,"Kubernetes - The Ultimate Platform for Containerized Application Management",Cloud
https://dzone.com/articles/generate-documents-and-send-in-bulk-for-e-signatur,"Generate Documents and Send Them in Bulk for E-Signature in Microsoft Power...",Cloud
https://dzone.com/articles/why-you-should-use-adobe-document-generation-api-w,"Why You Should Use Adobe Document Generation API With Adobe Sign",Cloud
https://dzone.com/articles/its-not-all-bad-using-cloud-drift-as-a-teachable-m,"It’s Not All Bad! Using Cloud Drift for Teachable Moments",Cloud
https://dzone.com/articles/how-to-deploy-a-spring-boot-app-on-aws-ecs-cluster,"How to Deploy a Spring Boot App on AWS ECS Cluster",Cloud
https://dzone.com/articles/global-saas-compliance-a-complete-audit-checklist,"Global SaaS Compliance: A Complete Audit Checklist",Cloud
https://dzone.com/articles/getting-started-with-azure-data-explorer-and-azure,"Exploring Azure Data Explorer and Azure Synapse Analytics for Big Data...",Cloud
https://dzone.com/articles/how-to-install-latest-version-kubernetes-cluster-o,"Installing the Latest Version of Kubernetes Cluster on Premises Using k0s...",Cloud
https://dzone.com/articles/moving-components-to-paas-what-to-expect,"Moving Components to PAAS? What To Expect",Cloud
https://dzone.com/articles/cloudhub-dedicated-load-balancer-advanced-concepts-internal-calls,"CloudHub Dedicated Load Balancer Advanced Concepts: Internal Calls",Cloud
https://dzone.com/articles/cloudhub-dedicated-load-balancer-advanced-concepts-basics,"CloudHub Dedicated Load Balancer Advanced Concepts: Basics",Cloud
https://dzone.com/articles/intro-to-google-cloud-vmware-engine-connecting-a-v,"Introduction to Google Cloud VMware Engine: Connecting a VPC",Cloud
https://dzone.com/articles/tools-to-visualize-your-terraform-plan,"Tools to Visualize your Terraform plan",Cloud
https://dzone.com/articles/observability-let-your-ide-debug-for-you,"Observability: Let Your IDE Debug for You",Cloud
https://dzone.com/articles/auto-filter-messages-into-subscriptions-in-azure-s,"Auto Filter Messages Into Subscriptions in Azure Service Bus Topic",Cloud
https://dzone.com/articles/dzone-live-the-cloud-security-episode,"DZone Live: The Cloud Security Episode",Cloud
https://dzone.com/articles/google-cloud-pubsub-messaging-with-spring-boot-25,"Google Cloud Pub/Sub: Messaging With Spring Boot 2.5",Cloud
https://dzone.com/articles/setup-google-cloud-pubsub,"Google Cloud Pub/Sub - Setup and Tryout",Cloud
https://dzone.com/articles/zapier-vs-choreo-web-based-integration-technologies-comparison,"Zapier vs. Choreo: How These Web-Based Integration Technologies Stack Up",Cloud
https://dzone.com/articles/provisioning-high-performance-storage-for-nosql-da,"Provisioning High-Performance Storage for NoSQL databases with OpenEBS",Cloud
https://dzone.com/articles/is-cloud-native-security-a-must,"Is Cloud-Native Security a Must?",Cloud
https://dzone.com/articles/micronaut-jpa-application-performance-on-aws-lambd,"Micronaut JPA Application Performance in AWS Lambda",Cloud
https://dzone.com/articles/what-is-sql-injection-types-examples-and-preventio,"What Is SQL Injection? Types, Examples, and Prevention",Cloud
https://dzone.com/articles/pros-and-cons-of-cloud-backup-and-recovery,"Pros and Cons of Cloud Backup and Recovery",Cloud
https://dzone.com/articles/understanding-ai-ops-part-2,"Understanding AI Ops: Part 2",Cloud
https://dzone.com/articles/containers-on-aws-which-service-is-right-for-your,"Containers on AWS: Which Service Is Right for Your Workload",Cloud
https://dzone.com/articles/a-guide-to-spot-readiness-in-kubernetes-1,"A Guide to Spot-Readiness in Kubernetes",Cloud
https://dzone.com/articles/why-and-when-to-opt-for-a-multicloud-strategy,"Why and When to Opt for a Multicloud Strategy?",Cloud
https://dzone.com/articles/evolution-of-k8s-worker-nodes-cri-o,"The Evolution of K8s Worker Nodes-CRI-O",Cloud
https://dzone.com/articles/using-best-practices-amp-cloud-native-aws-services,"Using Best Practices and Cloud Native AWS Services to Strengthen Security...",Cloud
https://dzone.com/articles/want-a-successful-cloud-migration-first-change-you,"Want a Successful Cloud Migration? First, Change Your Mindset",Cloud
https://dzone.com/articles/google-cloud-vmware-engine-establishing-an-sddc,"Intro to Google Cloud VMware Engine: Establishing an SDDC in Google Cloud",Cloud
https://dzone.com/articles/aws-stack-runner-deployment-stack-for-spring-boot-apps,"Setting Up an AWS App Runner Deployment Stack for Spring Boot Applications",Cloud
https://dzone.com/articles/replatform-for-your-cloud-migration-is-it-the-best,"Replatform For Your Cloud Migration: Is it the Best Strategy?",Cloud
https://dzone.com/articles/observability-in-hybrid-multi-cloud-environment,"Observability in Hybrid Multi-Cloud Environment",Cloud
https://dzone.com/articles/a-low-code-approach-for-serverless-file-extraction,"A Low Code Approach for Serverless File Extraction and Transfer",Cloud
https://dzone.com/articles/overcoming-critical-oracle-epm-cloud-migration-cha,"Overcoming Critical Oracle EPM Cloud Migration Challenges With Testing",Cloud
https://dzone.com/articles/most-frequently-asked-questions-surrounding-google,"Most Frequently Asked Questions Surrounding Google’s Cloud Operations...",Cloud
https://dzone.com/articles/hybrid-multi-cloud-dynamic-security-management,"Hybrid Multi-Cloud Dynamic Security Management",Cloud
https://dzone.com/articles/dzone-live-the-kubecon-preview-episode,"DZone Live The KubeCon Preview Episode",Cloud
https://dzone.com/articles/trend-check-saas-is-the-next-edge-business-require,"Trend Check: SAAS Is the Next-Edge Business Requirement",Cloud
https://dzone.com/articles/which-managed-kubernetes-is-right-for-me,"Which Managed Kubernetes Is Right for Me?",Cloud
https://dzone.com/articles/choosing-a-paas-provider-to-empower-not-limit-you,"Choosing a PaaS Provider To Empower, Not To Limit You",Cloud
https://dzone.com/articles/aws-cloud-migration-how-to-determine-first-mover-w-1,"AWS Cloud Migration: How To Determine First-Mover Workloads",Cloud
https://dzone.com/articles/free-docker-registries,"Free Docker Registries to Host Images",Cloud
https://dzone.com/articles/all-about-serverless-computing,"All About Serverless Computing",Cloud
https://dzone.com/articles/understanding-ai-ops,"Understanding AI Ops: Part 1",Cloud
https://dzone.com/articles/lessons-in-cloud-modern-engineering,"Lessons From The Trenches: Cloud Modern Engineering",Cloud
https://dzone.com/articles/deploy-postgresql-on-kubernetes-using-openebs-loca,"Deploy PostgreSQL On Kubernetes Using OpenEBS LocalPV",Cloud
https://dzone.com/articles/deploy-wordpress-on-aws-using-openebs,"Deploy WordPress on AWS Using OpenEBS",Cloud
https://dzone.com/articles/cloud-adoption-maturity-model-a-curtain-raiser,"Cloud Adoption Maturity Model: A Curtain-Raiser",Cloud
https://dzone.com/articles/kubernetes-cloud-native-report-one-authors-honest-review,"Kubernetes Cloud Native Report: One Author's Honest Review",Cloud
https://dzone.com/articles/aws-iam-policy-simulator,"AWS IAM Policy Simulator",Cloud
https://dzone.com/articles/comprehensive-guideline-on-salesforce-cloud-native,"Comprehensive Guideline On Salesforce Cloud Native",Cloud
https://dzone.com/articles/getting-started-with-azure-translator-service,"Getting Started With Azure Translator Service",Cloud
https://dzone.com/articles/the-future-of-ipaas,"The Future of iPaaS",Cloud
https://dzone.com/articles/overview-of-making-hybrid-multi-cloud-gitops-works,"Overview of Making Hybrid Multi-Cloud GitOps Work",Cloud
https://dzone.com/articles/a-first-impression-of-aws-app-runner,"The First Impression of AWS App Runner",Cloud
https://dzone.com/articles/what-is-google-cloud-pubsub-and-how-it-works,"Understanding Google Cloud Pub/Sub and How It Works",Cloud
https://dzone.com/articles/azure-api-app-vs-web-app,"Azure API App vs Web App",Cloud
https://dzone.com/articles/serverless-contact-form-using-aws-lambda-amp-kumol,"Serverless Contact Form Using AWS Lambda and Kumologica Forms Node",Cloud
https://dzone.com/articles/migrating-to-aws,"Migrating to AWS",Cloud
https://dzone.com/articles/cloud-factory-example-factory-deployment,"Cloud factory - Example factory deployment",Cloud
https://dzone.com/articles/a-study-of-hosting-and-managing-on-hybrid-multi-cl,"A Study of Hosting and Managing on Hybrid Multi-Cloud",Cloud
https://dzone.com/articles/a-guide-on-estimating-aws-ec2-workloads-for-a-micr,"A Guide on Estimating AWS EC2 Workloads for a Microservice Application",Cloud
https://dzone.com/articles/how-to-fight-the-coming-latency-wars,"How to Fight the Coming Latency Wars",Cloud
https://dzone.com/articles/what-are-cspm-tools-and-why-are-they-becoming-a-ne,"What Are CSPM Tools and Why Are They Becoming a Necessity?",Cloud
https://dzone.com/articles/why-use-localpv-with-nvme-for-your-workload,"Why Use LocalPV with NVMe for Your Workload?",Cloud
https://dzone.com/articles/how-5g-is-transforming-the-world-of-mobile-app-dev,"How 5G Is Transforming the World of Mobile App Development",Cloud
https://dzone.com/articles/cloud-factory-common-architectural-elements,"Cloud factory - Common architectural elements",Cloud
https://dzone.com/articles/revolutionary-role-of-cloud-computing-services-in,"Revolutionary Role of Cloud Computing Services in Retail Industry",Cloud
https://dzone.com/articles/container-attached-storage-cas-vs-shared-storage-w,"Container Attached Storage (CAS) vs. Shared Storage: Which One to Choose?",Cloud
https://dzone.com/articles/serverless-kafka-in-a-cloud-native-data-lake-archi,"Serverless Kafka in a Cloud-Native Data Lake Architecture",Cloud
https://dzone.com/articles/aws-vs-google-cloud-2021-comparing-the-two-cloud-g,"AWS vs. Google Cloud: Comparing the Giants",Cloud
https://dzone.com/articles/secure-your-move-to-the-cloud-a-roadmap-to-acceler,"Secure Your Move to the Cloud: A Roadmap to Accelerate Adoption",Cloud
https://dzone.com/articles/serverless-architecture-with-aws-cloud-development,"Serverless Architecture with AWS Cloud Development Kit (CDK)",Cloud
https://dzone.com/articles/cloud-factory-architectural-introduction,"Cloud factory - Architectural introduction",Cloud
https://dzone.com/articles/optimizing-aws-architecture-for-cost-management,"Optimizing AWS Architecture for Cost Management",Cloud
https://dzone.com/articles/how-to-trigger-aws-lambda-by-sms,"How To Trigger AWS Lambda by SMS",Cloud
https://dzone.com/articles/manage-webassembly-apps-in-wasmedge-using-docker-tools,"Manage WebAssembly Apps in WasmEdge Using Docker Tools",Cloud
https://dzone.com/articles/implementing-non-trivial-containerized-systems-part-4-adding-a-web-interface,"Implementing Non-Trivial Containerized Systems Part 4: Adding a Web...",Cloud
https://dzone.com/articles/the-three-pillars-of-kubernetes-troubleshooting,"The Three Pillars of Kubernetes Troubleshooting",Cloud
https://dzone.com/articles/do-you-really-need-kubernetes,"Do You Really Need Kubernetes?",Cloud
https://dzone.com/articles/google-cloud-pubsub-overview,"Google Cloud Pub/Sub - Overview",Cloud
https://dzone.com/articles/container-attached-storage-cas-vs-software-defined,"Container Attached Storage (CAS) vs. Software-Defined Storage - Which One...",Cloud
https://dzone.com/articles/containers-in-the-cloud-what-are-your-options,"Containers in the Cloud: What Are Your Options?",Cloud
https://dzone.com/articles/do-aws-reserved-instances-and-savings-plans-really,"Do AWS Reserved Instances and Savings Plans Really Reduce Costs?",Cloud
https://dzone.com/articles/enabling-docker-volume-local-direction-react-application,"Enabling Docker Volume Local Directory for a Docker React Application",Cloud
https://dzone.com/articles/persistent-volume-management-and-expansion-in-kubernetes,"Persistent Volume Management and Expansion in Kubernetes With Azure...",Cloud
https://dzone.com/articles/everything-you-need-to-know-kubernetes-scheduler,"Everything You Need To Know About Kubernetes Scheduler",Cloud
https://dzone.com/articles/6-best-practices-for-good-cloud-governance,"6 Best Practices for Good Cloud Governance",Cloud
https://dzone.com/articles/how-to-develop-successful-cloud-based-saas-applica,"How to Develop a Successful Cloud-Based SaaS Application in 2021",Cloud
https://dzone.com/articles/decoding-disaster-recovery-scenarios-in-aws,"Decoding Disaster Recovery Scenarios in AWS",Cloud
https://dzone.com/articles/cloud-hopping,"Cloud-Hopping",Cloud
https://dzone.com/articles/implementing-non-trivial-containerized-systems-part-2-containerizing-with-docker,"Implementing Non-Trivial Containerized Systems, Part 2: Containerizing With...",Cloud
https://dzone.com/articles/cloud-automation-in-2021-the-new-normal,"Cloud Automation in 2021: The New Normal in the Tech Industry",Cloud
https://dzone.com/articles/remote-server-management-example-remote-architectu,"Remote Server Management — Example Remote Architecture",Cloud
https://dzone.com/articles/hashicorp-becoming-important-part-of-spring-cloud,"HashiCorp Is Becoming an Important Part of Spring Cloud (Part 1)",Cloud
https://dzone.com/articles/setting-up-openshift-environment-variables-on-depl,"Setting up OpenShift Environment Variables on Deployment Configuration",Cloud
https://dzone.com/articles/a-secure-online-payment-for-cloud-marketing-1,"A Secure Online Payment for Cloud Marketing",Cloud
https://dzone.com/articles/explaining-cloud-computing-in-layman-terms,"Explaining Cloud Computing in Layman Terms",Cloud
https://dzone.com/articles/next-gen-data-pipes-with-spark-kafka-and-k8s,"Next-Gen Data Pipes With Spark, Kafka and k8s",Cloud
https://dzone.com/articles/removing-the-bastion-host-and-improving-the-securi,"Removing the Bastion Host and Improving the Security in AWS",Cloud
https://dzone.com/articles/deploying-a-quarkus-app-on-openshift-with-s2i-and,"Deploying a Quarkus App on OpenShift With S2I and OpenShift Pipelines",Cloud
https://dzone.com/articles/low-latency-edge-data-streaming-with-kafka-and-clo,"Low Latency Edge Data Streaming With Kafka and Cloud-Native 5G...",Cloud
https://dzone.com/articles/docker-multi-stage-build-for-running-react-applica,"Docker Multi-Stage Build for Running React Application on Nginx Server",Cloud
https://dzone.com/articles/remote-server-management-common-architectural-elem,"Remote server management - Common architectural elements",Cloud
https://dzone.com/articles/how-education-technology-has-become-more-important-1,"How Education Technology Has Become More Important Than Ever",Cloud
https://dzone.com/articles/five-common-challenges-faced-by-cloud-users,"Five Common Challenges Faced by Cloud Users",Cloud
https://dzone.com/articles/simplifying-iac-using-terraform-terragrunt-atlanti,"Simplifying IAC Using Terraform, Terragrunt, and Atlantis",Cloud
https://dzone.com/articles/a-guide-to-aws-instance-scheduler,"A Guide to AWS Instance Scheduler",Cloud
https://dzone.com/articles/free-book-best-practices-in-software-architecture,"Free book: Best Practices in Software Architecture in the Cloud era",Cloud
https://dzone.com/articles/unexpected-aws-charges-you-should-be-monitoring-cl,"Unexpected AWS Charges You Should Be Monitoring Closely",Cloud
https://dzone.com/articles/aws-data-pipeline-vs-glue-vs-lambda-who-is-a-clear,"AWS Data Pipeline vs Glue vs Lambda: Who Is a Clear Winner?",Cloud
https://dzone.com/articles/the-importance-of-persistent-storage-in-kubernetes,"The Importance of Persistent Storage in Kubernetes- OpenEBS",Cloud
https://dzone.com/articles/how-did-i-processed-half-a-million-transactions-in,"How Did I Process Half a Million Transactions in AWS Lambda Within Minutes?",Cloud
https://dzone.com/articles/vpc-auto-scaling-and-dedicated-hosts-with-terrafor,"VPC Auto Scaling and Dedicated Hosts with Terraform",Cloud
https://dzone.com/articles/how-can-i-know-what-happens-inside-amazon-rds,"The Ultimate Guide to Amazon RDS Database Notifications",Cloud
https://dzone.com/articles/the-benefits-of-using-nvme-for-kubernetes,"The Benefits of Using NVMe for Kubernetes",Cloud
https://dzone.com/articles/deploying-net-core-apis-in-aws-lambda,"Deploying .NET Core APIs in AWS Lambda",Cloud
https://dzone.com/articles/kubernetes-native-gateway-series-part-3-web-assemb,"Kubernetes Native Gateway Series (Part 3): Web Assembly at Scale with Gloo...",Cloud
https://dzone.com/articles/remote-server-management-an-architectural-introduc,"Remote Server Management — An Architectural Introduction",Cloud
https://dzone.com/articles/generate-google-cloud-api-credentials,"Generate Google Cloud API Credentials [Video]",Cloud
https://dzone.com/articles/confused-by-aws-storage-options-s3-ebs-amp-efs-explained,"Confused by AWS Storage Options? S3, EBS, EFS Explained",Cloud
https://dzone.com/articles/lead-generation-strategies-for-saas-2,"Lead Generation Strategies for SaaS",Cloud
https://dzone.com/articles/crash-course-amazon-ec2-pricing-and-cutting-your-a,"Crash Course: Amazon EC2 Pricing and Cutting Your AWS Bill",Cloud
https://dzone.com/articles/aws-application-deployment-basics-docker-container,"AWS Application Deployment Basics: Docker Containers",Cloud
https://dzone.com/articles/cloud-adoption-example-adoption-architecture,"Cloud adoption - Example adoption architecture",Cloud
https://dzone.com/articles/reducing-your-cloud-costs-by-90,"Reducing Your Cloud Costs by 90%",Cloud
https://dzone.com/articles/aws-eks-implementation-easy-ten,"AWS EKS Implementation",Cloud
https://dzone.com/articles/400-ec2-instance-types-the-good-the-bad-and-the-ug,"EC2 Instance Types: the Good, the Bad, and the Ugly",Cloud
https://dzone.com/articles/cloud-adoption-common-architectural-elements,"Cloud adoption - Common architectural elements",Cloud
https://dzone.com/articles/zoom-spotify-and-others-slashed-their-cloud-costs,"How Are Zoom, Spotify, etc Slashing Their Cloud Costs by Millions?",Cloud
https://dzone.com/articles/how-to-create-an-aws-alb-and-asg,"How to Create an AWS ALB and ASG",Cloud
https://dzone.com/articles/aws-application-deployment-basics-net-core-apps,"AWS Application Deployment Basics: .NET Core Apps",Cloud
https://dzone.com/articles/need-more-confidence-in-your-cloud-security-take-t-1,"5 Ways to Increase Your Cloud Security Confidence",Cloud
https://dzone.com/articles/one-gallon-of-milk-and-a-medium-sized-cloud-please,"One gallon of Milk and a medium sized Cloud please",Cloud
https://dzone.com/articles/cloud-adoption-an-architectural-introduction,"Cloud adoption — An architectural introduction",Cloud
https://dzone.com/articles/implementing-zero-trust-architecture-on-azure-hybr,"Implementing Zero Trust Architecture on Azure Hybrid Cloud",Cloud
https://dzone.com/articles/serverless-computing-vs-cloud-computing,"Serverless Computing vs Cloud Computing",Cloud
https://dzone.com/articles/kubernetes-native-gateway-series-part-3-web-assemb-1,"Kubernetes Native Gateway Series (Part 3): WebAssembly at Scale With Gloo...",Cloud
https://dzone.com/articles/building-a-lightweight-trino-distribution,"Building a Lightweight Trino Distribution",Cloud
https://dzone.com/articles/open-source-tools-you-should-be-aware-of-to-manage,"Open-Source Tools You Should Be Aware of to Manage Your Cloud",Cloud
https://dzone.com/articles/ibm-cloud-satellite-in-india-chennai-dc,"IBM Cloud Satellite in India Chennai DC",Cloud
https://dzone.com/articles/top-5-behavioral-emails-every-developer-tool-shoul,"Top 5 Behavioral Emails Every Developer Tool Should Use",Cloud
https://dzone.com/articles/a-detailed-amp-comprehensive-guide-to-disaggregate,"A Detailed and Comprehensive Guide to Disaggregated Storage",Cloud
https://dzone.com/articles/hybrid-multicloud-adoption,"Hybrid Multicloud Adoption",Cloud
https://dzone.com/articles/gitless-cloud-systems,"Gitless Cloud Systems",Cloud
https://dzone.com/articles/5-expensive-kubernetes-cost-traps-and-how-to-deal,"5 Costly Kubernetes Traps and Their Solutions",Cloud
https://dzone.com/articles/how-to-create-an-aws-ec2-vm,"How to Create an AWS EC2 VM",Cloud
https://dzone.com/articles/aws-cloud-development-kit-cdk-for-terraform-enabli,"AWS Cloud Development Kit (CDK) for Terraform: Enabling TypeScript and...",Cloud
https://dzone.com/articles/my-experience-with-the-cka-exam,"My Experience With The CKA Exam",Cloud
https://dzone.com/articles/interaction-with-autonomous-database-via-docker-co,"Interaction With Autonomous Database via Docker Container",Cloud
https://dzone.com/articles/popular-saas-podcasts-for-2021,"Popular SaaS Podcasts for 2021",Cloud
https://dzone.com/articles/from-solution-architecture-to-building-an-aws-serv,"From Architecture to an AWS Serverless POC: Architect's Journey",Cloud
https://dzone.com/articles/how-to-set-up-and-run-a-really-powerful-free-minec,"How to Set Up and Run a (Really Powerful) Free Minecraft Server in the...",Cloud
https://dzone.com/articles/aws-applications-deployment-basics-setup-nginx,"AWS Applications Deployment Basics: Setup NGINX",Cloud
https://dzone.com/articles/finding-optimal-nodes-kubernetes-cluster,"How to Find an Optimal Set of Nodes for A Kubernetes Cluster",Cloud
https://dzone.com/articles/deploy-an-aspnet-core-application-in-the-ibm-cloud,"Deploy an ASP.NET Core Application in the IBM Cloud Code Engine",Cloud
https://dzone.com/articles/deploying-percona-kubernetes-operators-using-opene,"Deploying Percona Kubernetes Operators using OpenEBS Local Storage",Cloud
https://dzone.com/articles/route53-quick-hands-on,"Route53 With a Private Hosted Zone",Cloud
https://dzone.com/articles/redis-streams-in-action-part-2-tweets-consumer-app,"Redis Streams in Action (Part 2): Tweets Consumer App",Cloud
https://dzone.com/articles/magic-terminal-over-web-sockets-and-signalr,"Magic Terminal over Web Sockets and SignalR",Cloud
https://dzone.com/articles/aws-app-deployment-basics-vpc-and-postgresql-setup,"AWS App Deployment Basics: VPC and PostgreSQL Setup",Cloud
https://dzone.com/articles/deploying-cockroachdb-on-kubernetes-using-openebs,"Deploying CockroachDB on Kubernetes using OpenEBS LocalPV",Cloud
https://dzone.com/articles/kustomize-a-tool-for-kubernetes-configuration-mana,"Kustomize: A Tool for Kubernetes Configuration Management",Cloud
https://dzone.com/articles/deploying-containerized-apps-on-aws-in-this-articl,"Deploying Containerized Apps on AWS? EKS vs. ECS For Workload Deployment",Cloud
https://dzone.com/articles/how-to-set-real-time-cost-alerts-in-kubernetes,"Setting Real-Time Cost Alerts in Kubernetes With Kubecost",Cloud
https://dzone.com/articles/kubernetes-adoption-accelerates-but-operational-ch,"Kubernetes Adoption Accelerates but Operational Challenges Persist",Cloud
https://dzone.com/articles/a-complete-guide-to-sap-testing,"A Complete Guide to SAP Testing",Cloud
https://dzone.com/articles/what-aws-lambda-metrics-should-you-definitely-be-m,"What AWS Lambda Metrics Should You Definitely Be Monitoring?",Cloud
https://dzone.com/articles/practical-top-down-resource-monitoring-of-a-kubern,"Practical Top-down Resource Monitoring of a Kubernetes Cluster With Metrics...",Cloud
https://dzone.com/articles/how-to-create-a-ubuntu-packer-image-and-deploy-on,"How to Create a Ubuntu Packer Image and Deploy on a Bare Metal Server",Cloud
https://dzone.com/articles/guide-to-aws-penetration-testing,"Guide to AWS Penetration Testing",Cloud
https://dzone.com/articles/top-practices-for-containers-kubernetes,"Top Practices for Containers, Kubernetes",Cloud
https://dzone.com/articles/net-promoter-scores-for-saas,"Net Promoter Scores for SaaS",Cloud
https://dzone.com/articles/customized-artemis-broker-configuration-with-init,"Customized Artemis Broker Configuration With Init Containers on Kubernetes...",Cloud
https://dzone.com/articles/iac-methodologies-approach-best-practices,"Infrastructure-as-Code (IaC): Methodologies, Approach, and Best Practices",Cloud
https://dzone.com/articles/container-images-for-aws-lambda-with-python,"Container Images for AWS Lambda With Python",Cloud
https://dzone.com/articles/deploy-elasticsearch-on-kubernetes-using-openebs-l,"Deploy Elasticsearch on Kubernetes Using OpenEBS LocalPV",Cloud
https://dzone.com/articles/6-lambda-optimization-strategies-that-work,"6 Lambda Optimization Strategies that Work",Cloud
https://dzone.com/articles/docker-image-tutorial,"Docker Image Tutorial",Cloud
https://dzone.com/articles/the-dark-side-of-docker-avoid-the-latest-tag,"The Dark Side of Docker: Avoid the “Latest” Tag",Cloud
https://dzone.com/articles/appops-with-kubernetes-and-devtron-the-perfect-fit,"AppOps with Kubernetes and Devtron - The Perfect Fit",Cloud
https://dzone.com/articles/aws-eks-vs-ecs-vs-fargate-where-to-manage-your-kub,"Managing Kubernetes: AWS EKS vs. ECS vs. Fargate",Cloud
