url,title,category
https://dzone.com/articles/goodbye-azure-portal-welcome-azure-cli,"Goodbye Azure Portal, Welcome Azure CLI",Cloud
https://dzone.com/articles/How-to-Stream-Docker-Containers-to-Your-Browser,"How to Stream Docker Containers to Your Browser",Cloud
https://dzone.com/articles/refactoring-infrastructure-as-code,"Refactoring Infrastructure as Code",Cloud
https://dzone.com/articles/api-gateway-to-eventbridge-with-pulumi,"API Gateway to EventBridge With Pulumi",Cloud
https://dzone.com/articles/backing-up-k8ssandra-with-minio-1,"Backing Up K8ssandra With MinIO",Cloud
https://dzone.com/articles/kubernetes-fundamentals-part-one,"Kubernetes Fundamentals: Part 1",Cloud
https://dzone.com/articles/5-best-azure-amp-cloud-computing-courses-for-begin,"5 Best Azure and Cloud Computing Courses for Beginners To Learn Online",Cloud
https://dzone.com/articles/cicd-with-azure-devops-and-ack-alibaba-cloud-kuber,"CI/CD With Azure DevOps and Alibaba Cloud Kubernetes (ACK)",Cloud
https://dzone.com/articles/effective-reporting-for-cloud-well-architected-ass,"Effective Reporting for Cloud Well-Architectured Frameworks",Cloud
https://dzone.com/articles/cloud-migration-checklist,"Cloud Migration Checklist",Cloud
https://dzone.com/articles/testing-serverless-functions,"Testing Serverless Functions",Cloud
https://dzone.com/articles/new-open-source-multi-cloud-asset-to-build-saas,"New Open-Source Multi-Cloud Asset to Build SaaS",Cloud
https://dzone.com/articles/setting-up-a-docker-registry-as-pull-through-cache,"Setting Up A Docker Registry As Pull Through Cache",Cloud
https://dzone.com/articles/how-to-secure-aws-api-gateway-with-cognito-user-po,"How to Secure AWS API Gateway With Cognito User Pool",Cloud
https://dzone.com/articles/unboxing-k8ssandra-the-data-layer-for-your-kuberne,"Unboxing K8ssandra: The Data Layer For Your Kubernetes-Powered Applications",Cloud
https://dzone.com/articles/how-to-integrate-infracost-with-terraform-cloud,"How To Integrate Infracost With Terraform Cloud",Cloud
https://dzone.com/articles/kubernetes-package-management-with-helm,"Kubernetes Package Management With Helm",Cloud
https://dzone.com/articles/a-comparison-of-current-kubernetes-distributions,"A Comparison of Current Kubernetes Distributions",Cloud
https://dzone.com/articles/advanced-kubernetes-deployment-strategies,"Advanced Kubernetes Deployment Strategies",Cloud
https://dzone.com/articles/docker-how-to-stop-and-remove-all-containers-at-on,"Docker: How to Stop and Remove All Containers at Once",Cloud
https://dzone.com/articles/kubernetes-comparison-eks-gke,"Managed Kubernetes Comparison: EKS vs GKE",Cloud
https://dzone.com/articles/crud-with-dynamodb-using-serverless-and-nodejs,"CRUD with DynamoDB Using Serverless and NodeJS",Cloud
https://dzone.com/articles/from-aspiration-to-action-begin-implementing-the-s,"From Aspiration to Action: Begin Implementing the Serverless Cloud",Cloud
https://dzone.com/articles/ces-2022-ambient-computing-integrations-announced,"CES 2022: Ambient Computing Integrations Announced for Vehicles",Cloud
https://dzone.com/articles/6-top-cloud-cost-optimization-issues-to-avoid-in-2,"6 Top Cloud Cost Optimization Issues To Avoid in 2022 and How To Deal With...",Cloud
https://dzone.com/articles/s3-compatible-object-storage-powered-by-blockchain,"S3-Compatible Object Storage Powered by Blockchain/Web3",Cloud
https://dzone.com/articles/serverless-security-aws-lambda,"5 Steps to Serverless Security With the AWS Lambda Plugin",Cloud
https://dzone.com/articles/aws-lambda-versions-and-aliases-explained-by-examp,"AWS Lambda Versions and Aliases Explained By Example",Cloud
https://dzone.com/articles/platform-engineering-with-pulumi-part-2-build-deploy-react,"Platform Engineering With Pulumi (Part 2): Build and Deploy a React.js...",Cloud
https://dzone.com/articles/service-discovery-from-within-the-kubernetes-clust,"Service Discovery From Within the Kubernetes Cluster",Cloud
https://dzone.com/articles/intelligently-adapt-kubernetes-clusters-to-use-spo,"Adapt Kubernetes Clusters to Use Spot Nodes",Cloud
https://dzone.com/articles/building-with-open-policy-agent-opa-for-better-pol,"Building With Open Policy Agent (OPA) for Better Policy as Code",Cloud
https://dzone.com/articles/the-cloud-security-solutions-why-cloud-computing-m,"The Cloud Security Solutions: Why Cloud Computing Must Be Used",Cloud
https://dzone.com/articles/what-are-the-7-rs-of-cloud-migration-strategy,"What Are the 7 Rs of Cloud Migration Strategy?",Cloud
https://dzone.com/articles/next-generation-cloud-connectivity,"Proxies, Gateways, and Meshes: Next Generation Cloud Connectivity",Cloud
https://dzone.com/articles/aws-cli-in-3-mins,"AWS CLI in 3 Minutes",Cloud
https://dzone.com/articles/why-application-cloud-migration-or-application-mod,"Application Cloud Migration or Application Modernization?",Cloud
https://dzone.com/articles/codeready-containers-beginners-guide-to-openshift,"CodeReady Containers - Beginners guide to OpenShift Container Platform...",Cloud
https://dzone.com/articles/inspecting-cloud-composer-apache-airflow,"Inspecting Cloud Composer - Apache Airflow",Cloud
https://dzone.com/articles/why-a-developer-should-be-a-bit-of-a-cloud-engineer,"Why a Developer Should Be a Bit of a Cloud Engineer: The Need for Cloud...",Cloud
https://dzone.com/articles/develop-spring-boot-rest-api-in-aws-part-4-codepip,"Develop a Spring Boot REST API in AWS: PART 4 (CodePipeline / CI/CD)",Cloud
https://dzone.com/articles/raising-the-bar-on-security-by-purging-credentials,"Raising the Bar on Security by Purging Credentials From the Cloud",Cloud
https://dzone.com/articles/getting-started-with-aws-amplify,"Getting Started With AWS Amplify",Cloud
https://dzone.com/articles/what-does-2022-have-in-store-for-cybersecurity-and,"What Does 2022 Have in Store for Cybersecurity and Cloud Security...",Cloud
https://dzone.com/articles/kubeflow-fundamentals-part-6-working-with-jupyter,"Kubeflow Fundamentals Part 6: Working With Jupyter Lab Notebooks",Cloud
https://dzone.com/articles/apache-kafka-as-cloud-native-ipaas-integration-mid,"Apache Kafka as Cloud-Native iPaaS Integration Middleware",Cloud
https://dzone.com/articles/everything-you-need-to-know-about-aws-graviton2,"Everything You Need to Know About AWS Graviton2",Cloud
https://dzone.com/articles/create-lambda-layers-in-aws-lambda,"Create Lambda Layers in AWS Lambda",Cloud
https://dzone.com/articles/25-most-commonly-used-blockchain-terms-explained,"25 Most Commonly Used Blockchain Terms Explained",Cloud
https://dzone.com/articles/deploy-an-application-for-azure-container-registry,"Deploy an Application for Azure Container Registry",Cloud
https://dzone.com/articles/grab-hold-of-meta-w-tech,"Grab Hold of Meta With Tech",Cloud
https://dzone.com/articles/systematic-and-chaotic-testing-a-way-to-achieve-cl,"Systematic and Chaotic Testing: A Way to Achieve Cloud Resilience",Cloud
https://dzone.com/articles/azure-create-azure-blob-storage-account-and-upload,"Create an Azure Blob Storage Account and Upload a File",Cloud
https://dzone.com/articles/microsoft-azure-app-service-cloud-services-or-vms,"Azure App Service, Azure Cloud Services, or VMs - Which Hosting Service Is...",Cloud
https://dzone.com/articles/how-to-connect-stateful-workloads-across-kubernete,"How To Connect Stateful Workloads Across Kubernetes Clusters",Cloud
https://dzone.com/articles/cloud-disaster-recovery-a-solution-to-your-cloud-r,"Cloud Disaster Recovery: A Solution to Your Cloud-Related Concerns",Cloud
https://dzone.com/articles/aws-karpenter-is-the-aws-open-source-kubernetes-autoscaler-right-for-you,"AWS Karpenter: Is the AWS Open Source Kubernetes Autoscaler Right for You?",Cloud
https://dzone.com/articles/observability-with-zero-code-instrumentation-meet,"eBPF: Observability with Zero Code Instrumentation [Video]",Cloud
https://dzone.com/articles/cube-cloud-deep-dive-starting-a-new-cube-app,"Cube Cloud Deep Dive: Starting a New Cube App",Cloud
https://dzone.com/articles/scaling-in-azure-app-service,"Scaling in Azure App Service – Almost Everything You Need To Know",Cloud
https://dzone.com/articles/monitoring-openshift-pods-with-ansible-and-zabbix,"Monitoring OpenShift PODS With Ansible and Zabbix Sender",Cloud
https://dzone.com/articles/running-enterprise-messaging-in-serverless-aws-far,"IBM MQ in ECS on AWS Fargate",Cloud
https://dzone.com/articles/diy-serverless-with-hyperlambda-kubernetes-and-pur,"DIY Serverless with Hyperlambda, Kubernetes and pure Magic",Cloud
https://dzone.com/articles/4-pitfalls-to-be-aware-of-when-adopting-a-hybrid-c-1,"4 Pitfalls To Be Aware of When Adopting a Hybrid Cloud",Cloud
https://dzone.com/articles/kubeflow-fundamentals-part-5-getting-started-with,"Kubeflow Fundamentals Part 5: Getting Started With Notebooks",Cloud
https://dzone.com/articles/cloud-app-security-top-10-things-developers-must-k,"Cloud App Security: Top 10 Preventions Developers Must Know",Cloud
https://dzone.com/articles/under-the-lid-how-atomicjar-is-reshaping-testconta,"Under the Lid: How AtomicJar is Reshaping Testcontainers",Cloud
https://dzone.com/articles/extracting-useful-information-from-your-kubernetes,"Extracting Useful Kubernetes Cluster Info With custom-columns and jq",Cloud
https://dzone.com/articles/tips-on-making-sprint-retrospectives-better-3,"5 Ways to Make Sprint Retrospectives Better",Cloud
https://dzone.com/articles/cloud-cost-management-alone-wont-fix-your-cloud-sp,"Cloud Cost Management Alone Won’t Fix Your Cloud Spend Problem",Cloud
https://dzone.com/articles/stream-landing-kafka-data-to-object-storage-using,"Stream Landing Kafka Data to Object Storage using Terraform",Cloud
https://dzone.com/articles/the-ultimate-guide-to-cloud-cost-optimization,"The Ultimate Guide to Cloud Cost Optimization",Cloud
https://dzone.com/articles/introduction-to-intelligent-cloud-machine-learning,"Intelligent Cloud: Machine Learning Integration in the Cloud",Cloud
https://dzone.com/articles/everything-you-need-to-know-about-gantt-chart-time,"Everything You Need to Know About Gantt Chart Timeline",Cloud
https://dzone.com/articles/platform-engineering-with-pulumi-part-1-landing-zone,"Platform Engineering With Pulumi (Part 1): Landing Zone",Cloud
https://dzone.com/articles/hybrid-multi-cloud-strategy-winning-theme-for-ente,"Hybrid Multi Cloud Strategy: Winning Theme For Enterprise",Cloud
https://dzone.com/articles/cloud-computing-security-parameters-on-various-cloud-platforms,"Cloud Computing Security Parameters on Various Cloud Platforms",Cloud
https://dzone.com/articles/custom-authentication-azure-api-gateway,"How to Set Custom Authentication with Azure API Gateway",Cloud
https://dzone.com/articles/install-apache-druid-kubernetes-quickly,"Setting Up Apache Druid on Kubernetes in Under 30 Minutes",Cloud
https://dzone.com/articles/how-to-use-amazon-sqs-in-a-spring-boot-app,"How to Use Amazon SQS in a Spring Boot App",Cloud
https://dzone.com/articles/developer-productivity-masterclass-interview,"Developer Productivity Masterclass: Interview With Leonid Blouvshtein",Cloud
https://dzone.com/articles/custom-authentication-in-the-cloud-with-amazon-api,"Custom Authentication in the Cloud with Amazon API Gateway and Lambda...",Cloud
https://dzone.com/articles/building-an-opensearch-index-from-dynamodb,"Building an OpenSearch Index from DynamoDB",Cloud
https://dzone.com/articles/how-to-delete-all-pods-in-replicaset,"How to Delete all Pods in a ReplicaSet",Cloud
https://dzone.com/articles/microservices-and-the-event-aggregator-pattern,"What Are Microservices and The Event Aggregator Pattern?",Cloud
https://dzone.com/articles/aws-cli-basics-part-3,"AWS CLI Basics – Part 3",Cloud
https://dzone.com/articles/what-is-cloud-ecommerce-solutions,"What is Cloud eCommerce Solutions?",Cloud
https://dzone.com/articles/open-source-otomi-provides-developer-self-service,"Otomi: OSS Developer Self-Service for Kubernetes",Cloud
https://dzone.com/articles/understanding-persistent-volumes-and-pvcs-in-kuber,"Understanding Persistent Volumes and PVCs in Kubernetes and OpenEBS",Cloud
https://dzone.com/articles/how-to-explain-kubernetes-to-a-business-team,"How to Explain Kubernetes to a Business Team",Cloud
https://dzone.com/articles/how-to-use-opentelemetry-with-aws-lambda,"How to Use OpenTelemetry With AWS Lambda",Cloud
https://dzone.com/articles/migrating-oracle-ebs-to-cloud-via-test-automation,"Migrating Oracle EBS to Cloud via Test Automation",Cloud
https://dzone.com/articles/containers-the-essentials,"Containers – The Essentials",Cloud
https://dzone.com/articles/google-cloud-vmware-engine-bastion-host-access-wit,"Intro to Google Cloud VMware Engine: Bastion Host Access With IAP",Cloud
https://dzone.com/articles/build-sustainable-applications-using-azure-service,"Build Sustainable Applications Using Azure Services",Cloud
https://dzone.com/articles/new-vs-code-debugging-tools-for-alexa,"New VS Code Debugging Tools for Alexa",Cloud
https://dzone.com/articles/becoming-cloud-native-1,"Becoming Cloud Native",Cloud
https://dzone.com/articles/multi-container-pod-design-patterns-in-kubernetes,"Multi-Container Pod Design Patterns in Kubernetes",Cloud
https://dzone.com/articles/how-to-start-cloud-application-development,"How To Start Cloud Application Development",Cloud
https://dzone.com/articles/microsoft-cloud-for-healthcare-architect-perspecti-2,"Microsoft Cloud for Healthcare: Architect Perspective",Cloud
https://dzone.com/articles/aws-cli-basics-part-2,"AWS CLI Basics – Part 2",Cloud
https://dzone.com/articles/aws-vs-azure-vs-gcp-cloud-web-services-comparison,"AWS vs Azure vs GCP: Cloud Web Services Comparison in Detail",Cloud
https://dzone.com/articles/kubeflow-fundamentals-part-4-external-add-ons,"Kubeflow Fundamentals Part 4: External Add-ons",Cloud
https://dzone.com/articles/codeanywhere-adventures-getting-started-with-devel-1,"Codeanywhere Adventures: Getting Started With Developer Decision Management...",Cloud
https://dzone.com/articles/aws-cli-basics,"AWS CLI – Basics",Cloud
https://dzone.com/articles/mulesoft-application-logs-to-amazon-cloudwatch,"Export Mulesoft Application Logs To Amazon Cloudwatch",Cloud
https://dzone.com/articles/production-horrors-handling-disasters-public-debri,"Production Horrors – Handling Disasters: Public Debrief",Cloud
https://dzone.com/articles/how-to-create-an-aws-cloudformation-fargate-templa,"How to Create an AWS CloudFormation Fargate Template",Cloud
https://dzone.com/articles/aws-serverless-constraints-iac-and-beyond,"AWS S3 Access via API Gateway, IaC, and More",Cloud
https://dzone.com/articles/cloud-metrics-a-tool-to-measure-success-of-cloud-a,"Cloud Metrics: A Tool to Measure Success of Cloud Adoption",Cloud
https://dzone.com/articles/aws-cloud-watch-ycrash-monitoring-rca,"AWS CloudWatch + yCrash = Monitoring + RCA",Cloud
https://dzone.com/articles/how-to-improve-mobile-application-performance-thro,"How To Improve Mobile Application Performance Through Cloud Integration",Cloud
https://dzone.com/articles/kubernetes-container-lifecycle-events-and-hooks,"Kubernetes Container Lifecycle Events and Hooks",Cloud
https://dzone.com/articles/cloud-observability,"Cloud Observability - Understand the Complex State of Your System",Cloud
https://dzone.com/articles/beginners-guide-to-using-amazon-s3-storage-classes,"Beginner’s Guide To Using Amazon S3 Storage Classes",Cloud
https://dzone.com/articles/the-cloud-continuum,"The Cloud Continuum",Cloud
https://dzone.com/articles/edge-cloud-benefits-and-top-considerations,"Edge Cloud: Benefits and Top Considerations",Cloud
https://dzone.com/articles/the-shifting-cloud-native-landscape-understanding,"The Shifting Cloud-Native Landscape: Understanding Kubernetes Compliance...",Cloud
https://dzone.com/articles/microsoft-cloud-for-retail-architect-perspective,"Microsoft Cloud for Retail: Architect Perspective",Cloud
https://dzone.com/articles/think-your-on-prem-app-is-cloud-stubborn-think-aga,"Think Your On-Prem App is Cloud Stubborn? Think Again!",Cloud
https://dzone.com/articles/dzone-cloud-show-kubecon-2021-recap,"DZone Cloud Show: KubeCon 2021 Recap",Cloud
https://dzone.com/articles/a-deep-dive-into-aws-control-toweran-innovative-mu,"A Deep Dive into AWS Control Tower — An Innovative Multi-Account Management...",Cloud
https://dzone.com/articles/benchmarking-aws-graviton2-and-gp3-support-for-apa,"Benchmarking AWS Graviton2 and gp3 Support for Apache Kafka",Cloud
https://dzone.com/articles/success-story-from-aws-emr-to-kubernetes,"Success Story: From AWS EMR to Kubernetes",Cloud
https://dzone.com/articles/how-to-discover-personal-data-in-cloud-storage,"How To Discover Personal Data in Cloud Storage",Cloud
https://dzone.com/articles/codeanywhere-adventures-getting-started-with-devel,"Codeanywhere adventures - Getting started with developer process automation...",Cloud
https://dzone.com/articles/block-amp-file-storage-object-amp-cloud-storage,"Block and File Storage + Object and Cloud Storage",Cloud
https://dzone.com/articles/continuous-integration-continuous-deployment-ci-cd,"CI/CD With Azure DevOps",Cloud
https://dzone.com/articles/aws-audit-and-security-strengthening,"AWS Audit and Security Strengthening",Cloud
https://dzone.com/articles/cloud-native-5g-mec-and-ossbssott-telco-with-apach,"Cloud-Native 5G, MEC and OSS/BSS/OTT Telco with Apache Kafka and Kubernetes",Cloud
https://dzone.com/articles/why-cloud-native-apps-need-cloud-native-ransomware-protection,"Why Cloud-Native Apps Need Cloud-Native Ransomware Protection",Cloud
https://dzone.com/articles/how-to-deploy-a-spring-boot-app-on-aws-fargate,"How to Deploy a Spring Boot App on AWS Fargate",Cloud
https://dzone.com/articles/introduction-to-helm-charts,"Introduction to Helm Charts",Cloud
https://dzone.com/articles/microsoft-cloud-for-financial-services-architect-p,"Microsoft Cloud for Financial Services — Architect Perspective",Cloud
https://dzone.com/articles/how-to-implement-cloud-migration-automation,"Automation-Driven Cloud Migration — An Introduction",Cloud
https://dzone.com/articles/leveraging-aws-for-backup-and-disaster-recovery-8,"Leveraging AWS for Backup and Disaster Recovery — 8 Best DR Practices",Cloud
https://dzone.com/articles/how-to-use-ketch-to-deploy-applications-on-kuberne,"Use Ketch to Deploy Apps on Kubernetes Without YAML",Cloud
https://dzone.com/articles/7-steps-to-improve-data-security-during-cloud-migr,"7 Steps To Improve Data Security During Cloud Migration",Cloud
https://dzone.com/articles/kubeflow-fundamentals-part-3-distributions-and-ins,"Kubeflow Fundamentals Part 3: Distributions and Installations",Cloud
https://dzone.com/articles/cloud-data-warehouse-comparison-redshift-vs-bigque,"Cloud Data Warehouse Comparison: Redshift vs. BigQuery vs. Azure vs....",Cloud
https://dzone.com/articles/benchmark-apps-aws-well-architected-framework,"Benchmark Your Apps Against the AWS Well-Architected Framework",Cloud
https://dzone.com/articles/getting-started-with-kubernetes-in-2-days,"Getting Started With Kubernetes In 2 Days",Cloud
https://dzone.com/articles/codeanywhere-adventures-creating-your-first-contai,"Codeanywhere adventures - Creating your first container project (part 2)",Cloud
https://dzone.com/articles/building-our-ecommerce-platform-with-serverless-faas,"Building Our E-Commerce Platform With Serverless FaaS",Cloud
https://dzone.com/articles/the-pros-and-cons-of-cloud-computing,"The Pros and Cons of Cloud Computing",Cloud
https://dzone.com/articles/efficient-model-training-in-the-cloud-case-study,"Efficient Model Training in the Cloud with Kubernetes, TensorFlow, and...",Cloud
https://dzone.com/articles/managing-docker-apps-with-kubernetes-ingress-contr,"Managing Docker Apps With Kubernetes Ingress Controller",Cloud
https://dzone.com/articles/aws-terraform-snitcher,"AWS Terraform Snitcher",Cloud
https://dzone.com/articles/monitoring-nvidia-gpu-usage-in-kubernetes-with-pro-1,"Monitoring NVIDIA GPU Usage in Kubernetes With Prometheus",Cloud
https://dzone.com/articles/elastic-stack-guide-part-2-heartbeat,"Elastic Stack Guide Part – 2 (Heartbeat)",Cloud
https://dzone.com/articles/edge-computing-the-future-of-cloud,"Edge Computing: The Future of Cloud",Cloud
https://dzone.com/articles/how-to-track-email-opens-clicks-and-bounces,"How to Track Email Opens, Clicks, and Bounces Using AWS SES, SNS, and...",Cloud
https://dzone.com/articles/why-devsecops-is-just-a-fancy-acronym-for-kubernet,"Why DevSecOps Is Just a Fancy Acronym for Kubernetes Service Ownership",Cloud
https://dzone.com/articles/use-vm-as-your-personal-computer-ft-vscode,"Use VM as Your Personal Computer Featuring VSCode [Video]",Cloud
https://dzone.com/articles/running-presto-in-a-hybrid-cloud-architecture-1,"Running Presto in a Hybrid Cloud Architecture",Cloud
https://dzone.com/articles/cloud-cost-optimization-a-pivotal-part-of-cloud-st,"Cloud Cost Optimization: A Pivotal Part of Cloud Strategy",Cloud
https://dzone.com/articles/kubernetes-on-aws-what-you-should-know-before-gett,"Kubernetes on AWS: What You Should Know Before Getting Started",Cloud
https://dzone.com/articles/solution-thinking-workshop,"Solution Thinking Design",Cloud
https://dzone.com/articles/cloud-as-an-enabler-for-sustainability,"Cloud as an Enabler for Sustainability",Cloud
https://dzone.com/articles/beginners-guide-to-installing-decision-management,"Beginners Guide to Installing Decision Management Tooling in a Local...",Cloud
https://dzone.com/articles/multiple-cloud-perspectives-and-introduction-to-az-1,"Multiple Cloud Perspectives and Introduction To Azure Arc",Cloud
https://dzone.com/articles/hybrid-multicloud-adoption-a-programmatic-approach,"Hybrid Multicloud Adoption: A Programmatic Approach To Get Started",Cloud
https://dzone.com/articles/microsoft-cloud-for-manufacturing-architect-perspe,"Microsoft Cloud for Manufacturing: An Architecture Perspective",Cloud
https://dzone.com/articles/cloud-technology-news-of-the-month-september-2021,"Cloud Technology News of the Month: September 2021",Cloud
https://dzone.com/articles/mainframe-modernization-to-cloud,"Mainframe Modernization to Cloud",Cloud
https://dzone.com/articles/deploy-rapids-on-gpu-enabled-virtual-servers-on-ib,"Deploy RAPIDs on GPU-Enabled Virtual Servers on a Virtual Private Cloud",Cloud
https://dzone.com/articles/kubernetes-for-application-developers-ckad,"Kubernetes for Application Developers (CKAD)",Cloud
https://dzone.com/articles/kubexpose-a-kubernetes-operator-for-fun-and-profit,"Kubexpose: A Kubernetes Operator for Fun and Profit!",Cloud
https://dzone.com/articles/five-different-ways-to-build-aws-infrastructure,"Five Different Ways to Build AWS Infrastructure",Cloud
https://dzone.com/articles/codeanywhere-adventures-getting-started-with-brows,"Codeanywhere adventures - Getting started with browser based development in...",Cloud
https://dzone.com/articles/a-minimalistic-python-wrapper-to-aws-dynamodb,"A Minimalistic Python Wrapper to AWS DynamoDB",Cloud
https://dzone.com/articles/after-the-lift-and-shift-10-steps-to-optimize-your,"After the Lift and Shift: 10 Steps To Optimize Your Cloud Efficiency",Cloud
https://dzone.com/articles/thoughfulness-innovation-cloud-computing,"The Green Lining in Cloud Computing",Cloud
https://dzone.com/articles/kubernetes-assimilation-persistence-is-futile,"Kubernetes Assimilation: Persistence Is Futile",Cloud
https://dzone.com/articles/mainframe-modernization-acceleration-by-openshift,"Mainframe Modernization Acceleration Through OpenShift",Cloud
https://dzone.com/articles/kubernetes-multi-node-on-prem-installation-with-k0,"Kubernetes Multi-Node On-Premise Installation With k0s Distribution",Cloud
https://dzone.com/articles/ipaas-for-mobile-developers,"iPaaS for Mobile Developers",Cloud
https://dzone.com/articles/how-to-deploy-tidb-on-google-cloud-platformpart-2,"How to Deploy TiDB on Google Cloud Platform—Part 2",Cloud
https://dzone.com/articles/open-networking-for-network-switches-how-the-open,"Open Networking for Network Switches - How the Open-Source DENT Project...",Cloud
https://dzone.com/articles/replacing-docker-desktop-with-hyperkit-minikube,"Replacing Docker Desktop With hyperkit + minikube",Cloud
https://dzone.com/articles/how-to-deploy-tidb-on-google-cloud-platformpart-1,"How to Deploy TiDB on Google Cloud Platform—Part 1",Cloud
https://dzone.com/articles/incident-review-aws-outage-led-to-spikes-in-respon-1,"Incident Review – AWS Outage Led To Spikes In Response Times For...",Cloud
https://dzone.com/articles/getting-started-with-kubeflow-on-google-cloud-plat,"Getting Started With Kubeflow on Google Cloud Platform",Cloud
https://dzone.com/articles/kubeflow-fundamentals-machine-learning-workflows-p,"Kubeflow Fundamentals: Machine Learning Workflows — Part 2",Cloud
https://dzone.com/articles/kubeflow-fundamentals-an-introduction,"Kubeflow Fundamentals: An Introduction",Cloud
https://dzone.com/articles/elastic-stack-guide-part-1,"Elastic Stack Guide Part – 1",Cloud
https://dzone.com/articles/importance-of-transit-gateway-in-anypoint-platform,"Importance of Transit Gateway in Anypoint Platform",Cloud
https://dzone.com/articles/how-to-use-open-source-kubecost-to-understand-and,"Use Open-Source Kubecost to Understand (and Control) Kubernetes Spending",Cloud
https://dzone.com/articles/top-challenges-in-saas-customer-onboarding,"Top Challenges in SAAS Customer Onboarding",Cloud
https://dzone.com/articles/multiple-cloud-perspectives-and-introduction-to-az,"Multiple Cloud Perspectives and Introduction To Azure Arc",Cloud
https://dzone.com/articles/how-to-run-chaos-experiments-on-your-physical-mach,"How to Run Chaos Experiments on Your Physical Machine",Cloud
https://dzone.com/articles/how-to-become-a-10x-software-developer-in-15-minut,"How to become a 10x Software Developer in 15 minutes",Cloud
https://dzone.com/articles/blockchain-network-with-hyperledger-fabric-peculia,"Blockchain Network with Hyperledger Fabric: Peculiarities and Use Cases",Cloud
