url,title,category
https://dzone.com/articles/write-your-kubernetes-infrastructure-as-go-code-ex,"Write Your Kubernetes Infrastructure as Go Code - Extend cdk8s With Custom...",Cloud
https://dzone.com/articles/google-cloud-messaging-android,"Google Cloud Messaging with Android",Cloud
https://dzone.com/articles/6-myths-about-the-cloud-that-you-should-stop-belie,"6 Myths About the Cloud That You Should Stop Believing",Cloud
https://dzone.com/articles/multi-cloud-management-tools-challenges-and-best-p,"Multi-Cloud Management: Tools, Challenges, and Best Practices",Cloud
https://dzone.com/articles/back-to-basics-accessing-kubernetes-pods,"Back to Basics: Accessing Kubernetes Pods",Cloud
https://dzone.com/articles/monitoring-blind-spots-and-what-to-do-about-them-1,"Monitoring Blind Spots in the Cloud and What to Do About Them",Cloud
https://dzone.com/articles/how-to-migrate-from-ecs-to-eks-and-the-1-trick-to,"How To Migrate From ECS to EKS and the #1 Trick To Make EKS Easier",Cloud
https://dzone.com/articles/shared-kubernetes-clusters-for-hybrid-and-multiclo,"Shared Kubernetes Clusters for Hybrid and Multi-Cloud",Cloud
https://dzone.com/articles/monitoring-at-the-edge-of-the-third-act-of-the-int,"Monitoring at the Edge of the Third Act of the Internet",Cloud
https://dzone.com/articles/verizons-data-breach-report-cloud-security-insights,"Verizon’s Data Breach Report: Cloud Security Insights",Cloud
https://dzone.com/articles/amazon-lightsail-virtual-cloud-server,"Amazon Lightsail: Virtual Cloud Server",Cloud
https://dzone.com/articles/kubernetes-data-simplicity-getting-started-with-k8,"Kubernetes Data Simplicity: Getting Started With K8ssandra",Cloud
https://dzone.com/articles/developing-a-cloud-adoption-strategy-1,"Developing a Cloud Adoption Strategy",Cloud
https://dzone.com/articles/everything-you-need,"Everything You Need to Know About Cloud Automation in 2022",Cloud
https://dzone.com/articles/what-is-cloud-storage-definition-types-pros-and-co,"What Is Cloud Storage: Definition, Types, Pros, and Cons",Cloud
https://dzone.com/articles/the-need-for-a-kubernetes-alternative,"The Need for a Kubernetes Alternative",Cloud
https://dzone.com/articles/debugging-a-wordle-bug,"Debugging a Wordle Bug",Cloud
https://dzone.com/articles/upgrading-kubernetes-cluster-with-cluster-api-on-oracle-cloud,"Upgrading Kubernetes Clusters With Cluster API on Oracle Cloud",Cloud
https://dzone.com/articles/common-mistakes-to-avoid-when-migrating,"Common Mistakes to Avoid When Migrating",Cloud
https://dzone.com/articles/cloud-tagging-strategic-practices-1,"Cloud Tagging Strategic Practices",Cloud
https://dzone.com/articles/installing-flex-gateway-on-the-kubernetes-as-a-ing-2,"Install Anypoint Flex Gateway on the Kubernetes as an Ingress Controller in...",Cloud
https://dzone.com/articles/the-best-infrastructure-as-code-tools-for-2022-1,"The Best Infrastructure as Code Tools for 2022",Cloud
https://dzone.com/articles/installing-flex-gateway-on-the-kubernetes-as-a-ing-1,"Install Anypoint Flex Gateway on the Kubernetes as an Ingress Controller in...",Cloud
https://dzone.com/articles/installing-flex-gateway-on-the-kubernetes-as-a-ing,"Install Anypoint Flex Gateway on the Kubernetes as an Ingress Controller in...",Cloud
https://dzone.com/articles/multi-cloud-identity-orchestration-what-does-the-f-1,"Multi-Cloud Identity Orchestration — What Does the Future Look Like?",Cloud
https://dzone.com/articles/5-best-practices-for-building-cloud-native-permiss,"5 Best Practices for Building Cloud-Native Permissions",Cloud
https://dzone.com/articles/how-to-bring-shadow-kubernetes-it-into-the-light,"How to Bring Shadow Kubernetes IT Into the Light",Cloud
https://dzone.com/articles/aws-azure-and-gcp-find-the-right-platform-1,"AWS, Azure, and GCP: Find the Right Platform",Cloud
https://dzone.com/articles/securing-access-to-kubernetes-environments-with-ze,"Securing Access to Kubernetes Environments With Zero Trust",Cloud
https://dzone.com/articles/getting-started-with-aws-config,"Introduction to AWS Config: Simplified Cloud Auditing",Cloud
https://dzone.com/articles/write-your-kubernetes-infrastructure-as-go-code-us,"Write Your Kubernetes Infrastructure as Go Code — Using Custom Resource...",Cloud
https://dzone.com/articles/aws-azure-and-gcp-the-ultimate-iam-comparison,"AWS, Azure, and GCP: The Ultimate IAM Comparison",Cloud
https://dzone.com/articles/deploy-ecr-based-aws-lambda,"Deploy ECR-Based AWS Lambda",Cloud
https://dzone.com/articles/yaml-and-its-usage-in-kubernetes,"YAML and Its Usage in Kubernetes",Cloud
https://dzone.com/articles/kubernetes-requests-and-limits-demystified,"Kubernetes Requests and Limits Demystified",Cloud
https://dzone.com/articles/learn-how-to-use-dynamodb-streams-with-aws-lambda,"Learn How To Use DynamoDB Streams With AWS Lambda and Go",Cloud
https://dzone.com/articles/invoking-an-aws-lambda-function-during-a-cdk-deplo,"Invoking an AWS Lambda Function During a CDK Deployment",Cloud
https://dzone.com/articles/developing-a-multi-cluster-friendly-kubernetes-operator,"Developing a Multi-Cluster-Friendly Kubernetes Operator",Cloud
https://dzone.com/articles/how-to-host-a-static-website-on-aws-with-s3-cloudf,"How to Host a Static Website on AWS With S3, CloudFront, Route53 and...",Cloud
https://dzone.com/articles/why-a-cloud-native-database-must-run-on-k8s,"Why a Cloud-Native Database Must Run on K8s",Cloud
https://dzone.com/articles/cleaning-out-the-server-closet-enterprise-sustaina,"Cleaning Out the Server Closet: Enterprise Sustainability Through Cloud...",Cloud
https://dzone.com/articles/policy-as-versioned-code,"Policy as (Versioned) Code",Cloud
https://dzone.com/articles/write-your-kubernetes-infrastructure-as-go-code-cd,"Write Your Kubernetes Infrastructure as Go Code — Cdk8s-Plus in Action!",Cloud
https://dzone.com/articles/access-undenied-on-aws,"Access Undenied on AWS",Cloud
https://dzone.com/articles/the-cost-of-production-blindness,"The Cost of Production Blindness",Cloud
https://dzone.com/articles/aws-lambda-provisioned-concurrency-autoscaling-con,"AWS Lambda Provisioned Concurrency AutoScaling Configuration With AWS CDK",Cloud
https://dzone.com/articles/write-your-kubernetes-infrastructure-as-go-code-ge,"Write Your Kubernetes Infrastructure as Go Code - Getting Started With...",Cloud
https://dzone.com/articles/cloud-security-testing-checklist-everything-you-ne,"Cloud Security Testing Checklist: Everything You Need to Know",Cloud
https://dzone.com/articles/kubernetes-cluster-backups-with-velero,"Kubernetes Cluster Backups With Velero",Cloud
https://dzone.com/articles/increasing-cloud-native-sustainability-with-observ,"Increasing Cloud-Native Sustainability With Observability",Cloud
https://dzone.com/articles/live-loading-to-deploy-kubernetes-on-bare-metal,"Live Loading to Deploy Kubernetes on Bare Metal",Cloud
https://dzone.com/articles/trends-we-are-watching-api-democratization-and-api,"Trends We Are Watching: API Democratization and API Management",Cloud
https://dzone.com/articles/scale-up-to-a-collaborative-and-multiplayer-archit,"Scale Up to a Collaborative and Multiplayer Architecture With Edge...",Cloud
https://dzone.com/articles/is-sustainability-the-new-security-amp-compliance,"Is Sustainability the New Security and Compliance?",Cloud
https://dzone.com/articles/lessons-learned-in-cloud-security-from-lapsus-surf,"Lessons Learned in Cloud Security From Lapsus$ Surfacing",Cloud
https://dzone.com/articles/azure-synapse-vs-snowflake-the-definitive-guide,"Azure Synapse vs Snowflake: The Definitive Guide",Cloud
https://dzone.com/articles/how-to-manage-a-red-hat-microshift-cluster-with-shipa,"How to Manage a Red Hat MicroShift Cluster with Shipa",Cloud
https://dzone.com/articles/understanding-kubernetes-resource-types,"Understanding Kubernetes Resource Types",Cloud
https://dzone.com/articles/how-to-operationalize-a-cloud-security-solution,"How to Operationalize a Cloud Security Solution",Cloud
https://dzone.com/articles/internal-developer-platform-in-plain-english,"Internal Developer Platform in Plain English",Cloud
https://dzone.com/articles/the-advanced-risk-of-basic-roles-in-gcp-iam,"The Advanced Risk of Basic Roles In GCP IAM",Cloud
https://dzone.com/articles/terraform-controller-cloud-resource-self-service,"Terraform Controller: Cloud Resource Self-Service",Cloud
https://dzone.com/articles/experiences-at-kubecon-europe-and-advice-for-trade,"Experiences at KUBECon Europe and Advice for Trade Shows",Cloud
https://dzone.com/articles/container-orchestration-tools-comparison,"Container Orchestration Tools Comparison",Cloud
https://dzone.com/articles/building-a-qr-code-generator-with-azure-functions,"Building a QR Code Generator with Azure Functions",Cloud
https://dzone.com/articles/deploying-java-applications-to-aws-elastic-beansta,"Deploying Java Applications to AWS Elastic Beanstalk",Cloud
https://dzone.com/articles/dynamically-provisioning-persistent-volumes-with-k,"Dynamically Provisioning Persistent Volumes with Kubernetes",Cloud
https://dzone.com/articles/five-myths-of-kubernetes,"5 Myths of Kubernetes",Cloud
https://dzone.com/articles/digging-out-data-with-adobe-pdf-extract-api,"Digging Out Data With Adobe PDF Extract API",Cloud
https://dzone.com/articles/how-to-reduce-cloud-cost-by-99-for-eda-kafka-appli,"How to Reduce Cloud Cost by 99% for EDA Kafka Applications",Cloud
https://dzone.com/articles/managing-applications-in-kubernetes-carvel-kapp-controller,"Managing Applications in Kubernetes With the Carvel Kapp Controller",Cloud
https://dzone.com/articles/kubernetes-monitoring-with-prometheus,"Kubernetes Monitoring With Prometheus",Cloud
https://dzone.com/articles/how-to-prevent-security-risks-in-the-private-cloud,"How to Prevent Security Risks in the Private Cloud",Cloud
https://dzone.com/articles/portfolio-architecture-examples-automation-collect,"Portfolio Architecture Examples: Automation Collection",Cloud
https://dzone.com/articles/portfolio-architecture-examples-infrastructure-col,"Portfolio Architecture Examples: Infrastructure Collection",Cloud
https://dzone.com/articles/portfolio-architecture-examples-telco-collection,"Portfolio Architecture Examples: Telco Collection",Cloud
https://dzone.com/articles/cloud-erp-vs-on-premise-erp-which-is-right-for-you,"Cloud ERP vs On-Premise ERP: Which Is Right for You?",Cloud
https://dzone.com/articles/news-roundup-from-kubecon-barcelona,"News Roundup From KubeCon Europe 2022",Cloud
https://dzone.com/articles/what-is-cloud-native-architecture,"What Is Cloud-Native Architecture?",Cloud
https://dzone.com/articles/apache-kafka-in-the-healthcare-industry,"Apache Kafka in the Healthcare Industry",Cloud
https://dzone.com/articles/build-a-twitter-leaderboard-app-with-redis-and-aws-2,"Build a Twitter Leaderboard App With Redis and AWS Lambda (Part 2)",Cloud
https://dzone.com/articles/the-serverless-database-you-really-want,"The Serverless Database You Really Want",Cloud
https://dzone.com/articles/aws-lambda-basics-writing-serverless-code,"AWS Lambda Basics: Writing Serverless Code",Cloud
https://dzone.com/articles/develop-a-daily-reporting-system-for-chaos-mesh-to,"Develop a Daily Reporting System for Chaos Mesh To Improve System...",Cloud
https://dzone.com/articles/A-Guide-to-Serverless-With-AWS-Lambda-and-Bitrise,"Introduction to Serverless With AWS Lambda and Bitrise API: Part 1",Cloud
https://dzone.com/articles/benefits-of-using-cloud-with-devops-services,"Benefits of Using Cloud With DevOps Services",Cloud
https://dzone.com/articles/awsterraform-workshop-5-aws-lambda-functions,"AWS/Terraform Workshop #5: AWS Lambda Functions",Cloud
https://dzone.com/articles/awsterraform-workshop-4-s3-iam-terraform-remote-state-and-jenkins,"AWS/Terraform Workshop #4: S3, IAM, Terraform Remote State, and Jenkins",Cloud
https://dzone.com/articles/awsterraform-workshop-2-ec2-networking-autoscaling,"AWS/Terraform Workshop (Part 2): EC2 Networking, Autoscaling Groups, and...",Cloud
https://dzone.com/articles/aws-lambda-with-mysql-rds-and-api-gateway,"AWS Lambda With MySQL (RDS) and API Gateway",Cloud
https://dzone.com/articles/cloud-native-core-banking-modernization-with-apach,"Cloud-Native Core Banking Modernization With Apache Kafka",Cloud
https://dzone.com/articles/build-cloud-native-apps-with-aws-app-runner-redis,"Build Cloud-Native Apps with AWS App Runner, Redis, and AWS CDK",Cloud
https://dzone.com/articles/cloud-based-ha-options-for-ibm-i-applications,"Choose Your Player: Cloud-Based High Availability Options for IBM i...",Cloud
https://dzone.com/articles/applying-kappa-architecture-to-make-data-available,"Applying Kappa Architecture to Make Data Available Where It Matters",Cloud
https://dzone.com/articles/creating-event-based-architecture-on-top-of-existi,"Creating Event-Based Architecture on Top of Existing API Ecosystem",Cloud
https://dzone.com/articles/ami-amp-snapshot-management-using-aws-lambda,"AMI and Snapshot Management Using AWS Lambda",Cloud
https://dzone.com/articles/build-a-twitter-leaderboard-app-with-redis-and-aws,"Build a Twitter Leaderboard App with Redis and AWS Lambda (Part 1)",Cloud
https://dzone.com/articles/geographic-scale-with-virtual-machines-and-kuberne,"Geographic Scale With Virtual Machines and Kubernetes Nodes",Cloud
https://dzone.com/articles/event-meshes-and-multicloud,"Event Meshes and Multi-Cloud",Cloud
https://dzone.com/articles/raft-or-not-the-best-solution-to-data-consistency,"Raft or Not? The Best Solution to Data Consistency in Cloud-native...",Cloud
https://dzone.com/articles/how-to-use-cluster-mesh-for-multi-region-kubernete,"How To Use Cluster Mesh for Multi-Region Kubernetes Pod Communication",Cloud
https://dzone.com/articles/6-enterprise-kubernetes-takeaways-from-kubecon-san,"6 Enterprise Kubernetes Takeaways from KubeCon San Diego",Cloud
https://dzone.com/articles/4-tips-for-creating-a-successful-saas-application,"4 Tips for Creating a Successful SaaS Application",Cloud
https://dzone.com/articles/15-useful-links-azure-users,"Useful Links for Azure Users",Cloud
https://dzone.com/articles/11-best-practices-to-do-functional-testing-on-the,"11 Best Practices to Do Functional Testing on the Cloud",Cloud
https://dzone.com/articles/why-we-decided-to-build-a-k8ssandra-operator-part,"Why We Decided to Build a K8ssandra Operator",Cloud
https://dzone.com/articles/demystifying-cloud-native-commerce,"Demystifying Cloud-Native Commerce",Cloud
https://dzone.com/articles/etl-with-aws-glue-interactive-sessions,"Performing ETL with AWS Glue Interactive Sessions",Cloud
https://dzone.com/articles/new-stackpod-episode-best-practices-for-aws-observ,"StackPod Episode: Best Practices for AWS Observability With Russell Foster...",Cloud
https://dzone.com/articles/top-six-kubernetes-best-practices-for-fleet-manage,"Top Six Kubernetes Best Practices for Fleet Management",Cloud
https://dzone.com/articles/deployment-of-low-latency-solutions-in-the-cloud,"Deployment of Low-Latency Solutions in the Cloud",Cloud
https://dzone.com/articles/real-time-supply-chain-with-apache-kafka-in-the-fo,"Real-Time Supply Chain With Apache Kafka in the Food and Retail Industry",Cloud
https://dzone.com/articles/podsecuritypolicy-is-dead-long-live,"PodSecurityPolicy Is Dead, Long Live...?",Cloud
https://dzone.com/articles/use-lambda-function-url-to-write-a-serverless-app,"Use Lambda Function URL To Write a Serverless App Backed by DynamoDB",Cloud
https://dzone.com/articles/securely-authenticate-to-google-cloud-from-github,"Securely Authenticate to Google Cloud From GitHub",Cloud
https://dzone.com/articles/package-and-deploy-a-lambda-function-as-a-docker-c,"Package and Deploy a Lambda Function as a Docker Container With AWS CDK",Cloud
https://dzone.com/articles/popular-kubernetes-alternatives-competitors,"The Most Popular Kubernetes Alternatives and Competitors",Cloud
https://dzone.com/articles/run-containers-and-vms-together-with-kubevirt,"Run Containers and VMs Together With KubeVirt",Cloud
https://dzone.com/articles/leveraging-change-data-capture-for-fraud-detection,"Leveraging Change Data Capture for Fraud Detection using Arcion Cloud",Cloud
https://dzone.com/articles/aws-serverless-lambda-resiliency,"AWS Serverless Lambda Resiliency: Part 1",Cloud
https://dzone.com/articles/aws-serverless-lambda-resiliency-patterns,"AWS Serverless Lambda Resiliency: Part 2",Cloud
https://dzone.com/articles/using-aws-lambda-function-url-to-build-a-serverles,"Using AWS Lambda Function URL To Build a Serverless Backend for Slack",Cloud
https://dzone.com/articles/5-common-step-functions-issues,"5 Common Step Functions Issues",Cloud
https://dzone.com/articles/diagrams-as-code-the-complete-how-to-use-guide,"Diagrams as Code: The Complete How-to-Use Guide",Cloud
https://dzone.com/articles/private-container-registry-in-alicloud-with-harbor,"Kubernetes-Based Private Container Registry in Alibaba Cloud With Harbor...",Cloud
https://dzone.com/articles/how-to-use-shipa-to-make-k8s-adoption-easier-for-developers,"How to Use Shipa to Make Kubernetes Adoption Easier for Developers",Cloud
https://dzone.com/articles/cloud-computing-architecture-for-healthcare,"Cloud Computing Architecture for Healthcare",Cloud
https://dzone.com/articles/manage-distributed-applications-in-kubernetes,"How to Manage Distributed Applications in Kubernetes Using Cilium and Istio",Cloud
https://dzone.com/articles/cost-governance-of-cloud-native-workloads-using-kubecost-and-kyverno,"Cost Governance of Cloud-Native Workloads Using Kubecost and Kyverno",Cloud
https://dzone.com/articles/not-just-buckets-are-you-aware-of-all-your-public,"Not Just Buckets: Are You Aware of ALL Your Public Resources?",Cloud
https://dzone.com/articles/configuring-apache-activemq-on-aws,"How to Configure Apache ActiveMQ on AWS",Cloud
https://dzone.com/articles/kubernetes-for-application-developers,"Introduction to Kubernetes for Application Developers",Cloud
https://dzone.com/articles/3-best-practices-to-make-cloud-migration-easier,"3 Best Practices To Make Cloud Migration Easier",Cloud
https://dzone.com/articles/cloud-pricing-comparison-aws-vs-azure-vs-google-cloud,"Cloud Pricing Comparison: AWS vs Azure vs Google Cloud",Cloud
https://dzone.com/articles/an-introduction-to-aws-step-functions,"An Introduction to AWS Step Functions",Cloud
https://dzone.com/articles/multi-cluster-cassandra-deployment-with-gke,"Multi-Cluster Cassandra Deployment With Google Kubernetes Engine (Pt. 2)",Cloud
https://dzone.com/articles/best-practices-tools-and-approaches-for-kubernetes,"Best Practices, Tools, and Approaches for Kubernetes Monitoring",Cloud
https://dzone.com/articles/azure-infrastructure-made-immutable-with-locks,"Azure Infrastructure Made Immutable With Locks",Cloud
https://dzone.com/articles/hotswapping-improving-cdk-development-cycle,"Hotswapping: Improving the CDK Development Cycle",Cloud
https://dzone.com/articles/how-to-put-a-database-in-kubernetes,"How to Put a Database in Kubernetes",Cloud
https://dzone.com/articles/3-steps-to-streamline-kubernetes-multi-cluster-man,"3 Steps To Streamline Kubernetes Multi-Cluster Management",Cloud
https://dzone.com/articles/oracle-fusion-cloud-vs-propel-plm,"Oracle Fusion Cloud vs. Propel PLM",Cloud
https://dzone.com/articles/how-to-deploy-github-projects-on-amazon-EC2,"A Complete Guide to Deploying Github Projects on Amazon EC2",Cloud
https://dzone.com/articles/deploy-a-multi-datacenter-apache-cassandra-cluster,"Deploy a Multi-Datacenter Apache Cassandra Cluster in Kubernetes (Pt. 1)",Cloud
https://dzone.com/articles/serverless-for-survival,"Serverless for Survival",Cloud
https://dzone.com/articles/environmental-impact-of-the-cloud-5-data-based-ins,"Environmental Impact of the Cloud: 5 Data-Based Insights and One Good Fix",Cloud
https://dzone.com/articles/delete-multiple-resources-resource-groups-azure-tags,"Delete Multiple Resources and Resource Groups in Azure With Tags",Cloud
https://dzone.com/articles/how-to-set-up-a-scalable-and-highly-available-grap-1,"How To Set Up a Scalable and Highly-Available GraphQL API in Minutes",Cloud
https://dzone.com/articles/delivering-your-code-to-the-cloud-with-jfrog-artifactory-and-github-actions,"Delivering Your Code to the Cloud With JFrog Artifactory and GitHub Actions",Cloud
https://dzone.com/articles/new-features-red-hat-data-grid-8-3,"6 New Features in Data Grid 8.3 Release",Cloud
https://dzone.com/articles/adobe-document-generation-microsoft-power-automate,"Hands-On With Adobe Document Generation in Microsoft Power Automate",Cloud
https://dzone.com/articles/aws-lambda-aliases-a-practical-approach,"AWS Lambda Aliases: A Practical Approach",Cloud
https://dzone.com/articles/top-aws-certificates-you-need-to-know,"The Top 11 AWS Certificates You Need to Know",Cloud
https://dzone.com/articles/top-aws-unmanaged-resources-that-you-should-know-about,"Legacy in Your Cloud: Top AWS Unmanaged Resources That You Should Know...",Cloud
https://dzone.com/articles/four-pillars-of-kubernetes-fleet-management,"Four Pillars of Kubernetes Fleet Management",Cloud
https://dzone.com/articles/the-cloud-challenge,"The Cloud Challenge: Choice Paralysis and the Bad Strategy of...",Cloud
https://dzone.com/articles/an-introduction-to-aws-serverless-application-mode,"An Introduction to AWS Serverless Application Model",Cloud
https://dzone.com/articles/migrating-java-applications-to-azure-app-service-p,"Migrating Spring Java Applications to Azure App Service (Part 1:...",Cloud
https://dzone.com/articles/remote-debugging-cloud-foundry-apps,"Remote Debugging Cloud Foundry Apps",Cloud
https://dzone.com/articles/cross-region-lambda-invocation-in-aws,"Cross-Region Lambda Invocation in AWS",Cloud
https://dzone.com/articles/dynamo-db-connector-operations-in-mule-4,"Amazon Dynamo DB Connector Operations Walkthrough in Mule 4, Part 1",Cloud
https://dzone.com/articles/how-to-reuse-your-ansible-roles-to-build-docker-im,"How To Reuse Your Ansible Roles To Build Docker Images With Packer",Cloud
https://dzone.com/articles/kubeflow-tips-amp-tricks-february-23rd-2022,"Kubeflow Machine Learning Tips and Tricks – February 2022",Cloud
https://dzone.com/articles/tips-for-managing-multi-cluster-kubernetes-deploym,"Tips for Managing Multi-Cluster Kubernetes Deployment With High...",Cloud
https://dzone.com/articles/trino-superset-and-ranger-on-kubernetes-what-why-h,"Trino, Superset, and Ranger on Kubernetes: What, Why, How?",Cloud
https://dzone.com/articles/installing-private-s3-storage-with-minio-on-alibab,"Installing Private S3 Storage With MinIO on Alibaba Cloud Kubernetes",Cloud
https://dzone.com/articles/cloud-computing-trends-for-watch-for,"Cloud Computing Trends for 2022",Cloud
https://dzone.com/articles/data-lives-longer-than-any-environment-data-manage,"Data Lives Longer Than Any Environment, Data Management Needs to Extend...",Cloud
https://dzone.com/articles/the-intelligent-storage-revolution,"The Intelligent Storage Revolution",Cloud
https://dzone.com/articles/cloud-migration-manual-the-adjustment-to-saas-mode,"Cloud Migration Manual: The Adjustment to SaaS Model",Cloud
https://dzone.com/articles/kubernetes-auditing-which-iam-user-deleted-a-names,"Kubernetes Auditing: Which IAM User Deleted a Namespace?",Cloud
https://dzone.com/articles/how-to-use-embedded-hazelcast-on-kubernetes-1,"How to Use Embedded Hazelcast on Kubernetes",Cloud
https://dzone.com/articles/the-hidden-shortcut-to-increasing-fintech-gross-ma,"The Hidden Shortcut to Increasing Fintech Gross Margins – Cloud Automation",Cloud
https://dzone.com/articles/cloud-based-multimedia-solutions,"Designing Cloud-Based Multimedia Solutions",Cloud
https://dzone.com/articles/top-google-cloud-certification,"Top 9 Google Cloud Platform Certification Courses for 2022",Cloud
https://dzone.com/articles/cassandra-database-migration-to-kubernetes-with-ze,"Cassandra Database Migration to Kubernetes with Zero Downtime",Cloud
https://dzone.com/articles/modernizing-a-legacy-microsoftnet-application-by-u,"Modernizing a Legacy Microsoft .NET Application by Upgrading It to the...",Cloud
https://dzone.com/articles/enter-the-cloud-native-dojo-blackbelt-level-debugg,"Enter the Cloud Native Dojo: Blackbelt-Level Debugging",Cloud
https://dzone.com/articles/cdk-lessons-learned,"5 CDK Lessons Learned",Cloud
https://dzone.com/articles/cloud-systems-part-three-deploying-to-amazon-ecs,"Cloud Systems (Part 3): Deploying to Amazon ECS",Cloud
https://dzone.com/articles/containers-landscape-seen-through-oci-and-cncf-standards-lenses,"Containers Landscape: Seen Through OCI and CNCF Standards Lenses",Cloud
https://dzone.com/articles/detect-untagged-pdfs-for-accessibility,"Detect Untagged PDFs for Accessibility",Cloud
https://dzone.com/articles/5-best-google-cloud-platform-gcp-courses-for-begin,"5 Best Google Cloud Platform (GCP) Courses for Beginners",Cloud
https://dzone.com/articles/low-code-aging-like-wine,"Low-Code: Aging Like Wine",Cloud
https://dzone.com/articles/cloud-systems-part-two-containerizing-a-website,"Cloud Systems (Part 2): Containerizing a Website",Cloud
https://dzone.com/articles/python-sdks-package-management-in-gcp-artifact-reg,"Python SDKs Package Management in GCP Artifact Registry",Cloud
https://dzone.com/articles/row-vs-columnar-storage-for-cloud-based-data,"Row vs. Columnar Storage for Cloud-Based Data",Cloud
https://dzone.com/articles/the-search-for-a-cloud-native-database,"The Search for a Cloud-Native Database",Cloud
https://dzone.com/articles/cloud-systems-part-one-static-sites-and-aws-s3,"Cloud Systems (Part 1): Static Sites and AWS S3",Cloud
https://dzone.com/articles/enterprise-computing-and-the-public-cloud-dilemma,"Enterprise Computing and the Public Cloud Dilemma",Cloud
https://dzone.com/articles/kubernetes-fundamentals-part-two,"Kubernetes Fundamentals - Part 2",Cloud
https://dzone.com/articles/connect-external-opensearch-dashboard-to-aws-opens,"Connect External OpenSearch Dashboard to AWS OpenSearch Domain With Helm",Cloud
https://dzone.com/articles/kubernetes-kops-for-cluster-management,"Kubernetes kOps for Cluster Management",Cloud
