url,title,category
https://dzone.com/articles/codeready-containers-installing-business-automatio-2,"CodeReady Containers - Installing business automation operator (Part 3)",Cloud
https://dzone.com/articles/oracle-cloud-bi-reports,"Oracle Cloud BI Reports",Cloud
https://dzone.com/articles/azure-monitor-and-serverless360-comparison,"Azure Monitor and Serverless360 Comparison",Cloud
https://dzone.com/articles/codeready-containers-exploring-a-home-loan-mortgag,"CodeReady Containers - Exploring a home loan mortgage process",Cloud
https://dzone.com/articles/implementing-multi-session-sequential-convoy-patte,"Implementing Multi-Session Sequential Convoy Pattern with Azure Service Bus...",Cloud
https://dzone.com/articles/hybrid-cloud-implementation-for-enterprises,"Hybrid Cloud Implementation for Enterprises",Cloud
https://dzone.com/articles/which-aws-storage-solution-is-right-for-your-elast,"Which AWS Storage Solution Is Right for Your Elasticsearch Cluster?",Cloud
https://dzone.com/articles/how-to-make-docker-build-run-faster,"How to Make Docker Build Run Faster",Cloud
https://dzone.com/articles/how-to-test-saas-platforms,"How to Test SaaS Platforms",Cloud
https://dzone.com/articles/affordable-kubernetes-for-personal-projects,"Affordable Kubernetes for Personal Projects",Cloud
https://dzone.com/articles/dynamic-nfs-provisioning-in-red-hat-openshift,"Dynamic NFS Provisioning in Red Hat OpenShift",Cloud
https://dzone.com/articles/capacity-management-in-a-cloud-environment,"Capacity Management in a Cloud Environment",Cloud
https://dzone.com/articles/why-migrate-to-kubernetes-in-2021-key-devops-and-d,"Why Migrate to Kubernetes in 2021: Key DevOps and DataOps Benefits",Cloud
https://dzone.com/articles/lessons-learned-from-aws-services-outage-nov-2020,"Lessons Learned from the November AWS Outage",Cloud
https://dzone.com/articles/understanding-kubernetes-operators,"Understanding Kubernetes Operators",Cloud
https://dzone.com/articles/using-shipa-to-automate-kubernetes-object-creation,"Using Shipa to Automate Kubernetes Object Creation",Cloud
https://dzone.com/articles/exploring-kubernetes-with-gigi-sayfan,"Exploring Kubernetes With Gigi Sayfan",Cloud
https://dzone.com/articles/migrating-to-the-cloud-6-strategies-for-future-suc,"Migrating to the Cloud: 6 Strategies for Future Success",Cloud
https://dzone.com/articles/new-cloud-services-are-foundational-to-gaining-con,"New Cloud Services Are Foundational to Gaining Control Over Content",Cloud
https://dzone.com/articles/webinar-hybrid-cloud-for-financial-services-series-1,"Webinar - Hybrid cloud for financial services series features payments...",Cloud
https://dzone.com/articles/twilio-vs-mirrorfly-who-is-the-future-of-real-time,"Twilio Vs. MirrorFly: Who Is the Future of Real-Time Communication?",Cloud
https://dzone.com/articles/aws-cloud-migration-your-checklist-to-success,"AWS Cloud Migration: Your Checklist to Success",Cloud
https://dzone.com/articles/cloud-myth-ahead-of-time-compilation-will-save-you,"Cloud Myth: Ahead of Time Compilation Will Save You Money",Cloud
https://dzone.com/articles/gridgains-apache-ignite-operator-for-kubernetes-an,"GridGain's Apache Ignite Operator for Kubernetes and Other Cloud Updates",Cloud
https://dzone.com/articles/reducing-cloud-waste-with-automatically-scheduled,"Reducing Cloud Waste With Automatically Scheduled Hibernation",Cloud
https://dzone.com/articles/kubernetes-is-deprecating-docker-support-and-why-w,"Kubernetes Is Deprecating Docker Support and Why We Shouldn't Worry That...",Cloud
https://dzone.com/articles/cloud-governance-why-it-is-critical-for-the-succes,"Why Is Cloud Governance Critical for the Success of Cloud Adoption?",Cloud
https://dzone.com/articles/monitor-applications-via-application-insights-usin,"Monitor Applications Via Application Insights Using Log Alerts",Cloud
https://dzone.com/articles/openshift-pull-image-from-one-project-to-another,"OpenShift Pull Image From One Project to Another",Cloud
https://dzone.com/articles/virtualization-vs-cloud-computing-how-to-easily-di,"Virtualization vs. Cloud Computing: How to Easily Differentiate",Cloud
https://dzone.com/articles/7-step-data-migration-plan,"7-Step Data Migration Plan",Cloud
https://dzone.com/articles/ensuring-a-smooth-kubernetes-dockershim-deprecatio,"Ensuring a Smooth Kubernetes Dockershim Deprecation With Chaos Engineering",Cloud
https://dzone.com/articles/benefits-of-serverless-for-startups,"Benefits of Serverless For Startups",Cloud
https://dzone.com/articles/serverless-visitor-counter-badge-with-azure-functi,"Serverless Visitor Counter Badge with Azure Functions",Cloud
https://dzone.com/articles/how-do-serverless-functions-actually-work-exam,"How Do Serverless Functions Actually Work? Examining AWS Lambda to...",Cloud
https://dzone.com/articles/user-authentication-with-aws-cognito,"User Authentication With Amazon Cognito",Cloud
https://dzone.com/articles/apache-kafka-fundamentals,"Apache Kafka Fundamentals",Cloud
https://dzone.com/articles/lets-run-cloud-native-computing-through-the-wash,"Let’s Run Cloud-Native Computing Through the Wash",Cloud
https://dzone.com/articles/how-to-setup-refinitivs-amazon-ec2-machine-image-f-1,"Using Refinitiv's Amazon EC2 Machine Image For a Real-Time Application",Cloud
https://dzone.com/articles/codeready-containers-installing-business-automatio-1,"CodeReady Containers - Installing Business Automation Operator (Part 2)",Cloud
https://dzone.com/articles/adjust-speaking-ratessml-via-curl-post,"Adjust speaking rate(SSML) via cURL POST",Cloud
https://dzone.com/articles/dzone-trend-report-leaders-in-tech,"DZone Trend Report: Leaders in Tech",Cloud
https://dzone.com/articles/an-introduction-to-cloud-native-devops,"An Introduction to Cloud-Native DevOps",Cloud
https://dzone.com/articles/tutorial-how-to-simulate-a-multi-region-cockroachd,"How to Simulate a Multi-Region CockroachDB Cluster on localhost With Docker",Cloud
https://dzone.com/articles/how-to-create-e-learning-cloud-software-users-will,"How to Create E-Learning Cloud Software Users Will Love",Cloud
https://dzone.com/articles/all-you-need-to-know-for-selenium-testing-on-the-c,"All You Need to Know for Selenium Testing on the Cloud",Cloud
https://dzone.com/articles/how-to-create-an-aws-continuous-deployment-pipelin-1,"How to Create an AWS Continuous Deployment Pipeline Cont’d",Cloud
https://dzone.com/articles/answers-to-5-kubernetes-ckad-practice-questions,"Answers to 5 Kubernetes CKAD Practice Questions",Cloud
https://dzone.com/articles/complete-guide-to-develop-cloud-based-application,"A Complete Guide To Develop A Cloud-Based Application",Cloud
https://dzone.com/articles/serverless-in-financial-services-1,"Serverless in Financial Services",Cloud
https://dzone.com/articles/using-docker-swarm-secrets-to-store-rotate-ssl-certificates-nginx,"Using Docker Swarm Secrets to Store and Rotate your SSL Certificates with...",Cloud
https://dzone.com/articles/5-best-practices-for-cloud-cost-optimization,"5 Best Practices for Cloud Cost Optimization",Cloud
https://dzone.com/articles/8-configuration-management-tools-for-creating-serv,"8 Configuration Management Tools for Creating Serverless Apps in AWS",Cloud
https://dzone.com/articles/aws-cloud-monitoring-best-practices-and-top-notch,"AWS Cloud Monitoring: Best Practices and Top-Notch Tools",Cloud
https://dzone.com/articles/codeready-containers-installing-business-automatio,"CodeReady Containers - Installing business automation operator (Part 1)",Cloud
https://dzone.com/articles/how-to-create-an-aws-continuous-deployment-pipelin,"How to Create an AWS Continuous Deployment Pipeline",Cloud
https://dzone.com/articles/using-cloud-computing-to-build-a-remote-organizati,"Using Cloud Computing To Build a Remote Organization",Cloud
https://dzone.com/articles/how-to-deploy-azure-function-apps-with-powershell,"How to Deploy Azure Function Apps With Powershell",Cloud
https://dzone.com/articles/aws-well-architected-framework-in-serverless-part,"AWS Well-Architected Framework in Serverless Part I: Security",Cloud
https://dzone.com/articles/deploy-friday-e32,"Deploy Friday: E32 Elasticsearch Lightning-fast Search at Scale With Ease",Cloud
https://dzone.com/articles/delete-a-non-empty-cos-bucket-using-terraform,"Delete a Non-Empty COS Bucket Using Terraform",Cloud
https://dzone.com/articles/influencing-factors-in-choosing-the-right-cloud-se,"Influencing Factors in Choosing the Right Cloud Service Provider for...",Cloud
https://dzone.com/articles/gain-better-visibility-into-kubernetes-cost-alloca,"Gain Better Visibility Into Kubernetes Cost Allocation",Cloud
https://dzone.com/articles/load-balancer-explained-simplified-through-comics,"Load Balancer Explained – Simplified Through Comics",Cloud
https://dzone.com/articles/aws-step-functions-use-cases,"AWS Step Functions Use Cases",Cloud
https://dzone.com/articles/kubernetes-operators-in-go,"Kubernetes Operators in Go",Cloud
https://dzone.com/articles/when-is-it-time-to-retire-your-legacy-system-and-g,"When Is It Time to Retire Your Legacy System and Go Cloud?",Cloud
https://dzone.com/articles/serverless-eventing-architecture,"Serverless Eventing Architecture",Cloud
https://dzone.com/articles/how-to-deploy-a-spring-cloud-function-on-aws-lambd,"How to Deploy a Spring Cloud Function on AWS Lambda",Cloud
https://dzone.com/articles/large-scale-cloud-migrations-challenges-and-recomm,"Large Scale Cloud Migrations: Challenges and Recommendations",Cloud
https://dzone.com/articles/getting-to-the-bottom-of-the-multi-cloud-managemen,"Getting to the Bottom of the Multi-Cloud Management Hype",Cloud
https://dzone.com/articles/tips-for-optimizing-docker-builds,"Tips for Optimizing Docker Builds",Cloud
https://dzone.com/articles/pros-and-cons-of-cloudwatch-for-error-monitoring,"Pros and Cons of CloudWatch for Error Monitoring",Cloud
https://dzone.com/articles/monitoring-yugabytedb-in-kubernetes-with-the-prome,"Monitoring YugabyteDB in Kubernetes",Cloud
https://dzone.com/articles/diy-cloud-systems,"DIY Cloud Systems",Cloud
https://dzone.com/articles/simplifying-terraform-deployments-with-ansible-par-1,"Simplifying Terraform Deployments With Ansible - Part 2",Cloud
https://dzone.com/articles/monitoring-your-kubernetes-cluster-the-right-way,"Monitoring Your Kubernetes Cluster the Right Way",Cloud
https://dzone.com/articles/elastic-computing-meets-low-code-1,"Elastic Computing Meets Low Code",Cloud
https://dzone.com/articles/webinar-hybrid-cloud-for-financial-services-series,"Webinar - Hybrid cloud for financial services series features payments...",Cloud
https://dzone.com/articles/how-to-become-a-cloud-native-company-and-13-tools,"How to Become a Cloud-Native Company and 13 Tools to Get You There",Cloud
https://dzone.com/articles/navigating-the-perplexities-of-cloud-centric-pytho,"Navigating the Perplexities of Cloud-Centric Python Development",Cloud
https://dzone.com/articles/how-kubernetes-can-help-to-operationalize-your-con,"How Kubernetes Can Help to Operationalize Your Container Security",Cloud
https://dzone.com/articles/an-introduction-to-red-hat-openshift-codeready-con,"An Introduction to Red Hat OpenShift CodeReady Containers",Cloud
https://dzone.com/articles/everything-you-need-to-know-about-cloud-testing,"Everything You Need To Know About Cloud Testing",Cloud
https://dzone.com/articles/aws-scheduled-lambda-function-possible-options-and,"AWS Scheduled Lambda Function: Possible Options and Ultimate Solution",Cloud
https://dzone.com/articles/building-a-simple-kafka-client-for-the-web-and-des,"Building a Simple Kafka Client for the Web and Desktop",Cloud
https://dzone.com/articles/benefits-of-hybrid-cloud-for-data-warehouse,"Benefits of Hybrid Cloud for Data Warehouse",Cloud
https://dzone.com/articles/simplifying-terraform-deployments-with-ansible-par,"Simplifying Terraform Deployments with Ansible - Part 1",Cloud
https://dzone.com/articles/setting-the-reliability-standard,"Setting the Reliability Standard",Cloud
https://dzone.com/articles/on-premise-to-cloud-migration-4-key-challenges-in-becoming-cloud-native,"On-Premise to Cloud Migration: 4 Key Challenges in Becoming Cloud-Native",Cloud
https://dzone.com/articles/reduce-the-cloud-bill-of-your-java-applications,"Reduce the Cloud Bill of Your Java Applications",Cloud
https://dzone.com/articles/multi-user-applications-with-pouchdb-and-ibm-cloud,"Multi-User Applications With PouchDB and IBM Cloudant",Cloud
https://dzone.com/articles/codeready-containers-exploring-a-nodejs-front-end,"CodeReady Containers - Exploring a Node.js Front End with Decision...",Cloud
https://dzone.com/articles/what-is-scriptless-testing-and-how-can-it-help-you,"What Is Scriptless Testing? How Can It Help You?",Cloud
https://dzone.com/articles/solving-the-challenges-of-serverless-at-scale,"Solving the Challenges of Serverless at Scale",Cloud
https://dzone.com/articles/how-to-reduce-docker-image-size,"How to Reduce Docker Image Size",Cloud
https://dzone.com/articles/7-best-log-management-tools-for-kubernetes-2020,"7 Best Log Management Tools for Kubernetes [2020]",Cloud
https://dzone.com/articles/how-to-deploy-a-spring-boot-app-to-aws-elastic-bea,"How to Deploy a Spring Boot App to AWS Elastic Beanstalk",Cloud
https://dzone.com/articles/deploy-and-auto-scale-isolated-workloads-across-mu,"Deploy and Auto Scale Isolated Workloads Across Multiple Zones",Cloud
https://dzone.com/articles/a-day-in-the-life-of-a-software-engineer-a-develop-1,"A Day in the Life of a Software Engineer: A Developer’s Perspective on...",Cloud
https://dzone.com/articles/the-cloud-is-booming-so-is-the-cloud-spend,"The Cloud Is Booming, so Is the Cloud Spending",Cloud
https://dzone.com/articles/how-to-create-ec2-instance-in-aws-tutorial-for-beg,"How to Create EC2 Instance in AWS — Tutorial for Beginners",Cloud
https://dzone.com/articles/aws-serverless-platform-2,"AWS Serverless Platform",Cloud
https://dzone.com/articles/understanding-amazon-elastic-container-service-for,"Understanding Amazon Elastic Container Service for Kubernetes (EKS)",Cloud
https://dzone.com/articles/running-presto-kubernetes-ahana-aws,"Running Presto on Kubernetes With Ahana Cloud and AWS EKS",Cloud
https://dzone.com/articles/monitoring-health-of-aspnet-core-background-servic,"Monitoring Health of ASP.NET Core Background Services With TCP Probes on...",Cloud
https://dzone.com/articles/configure-cross-account-access-and-codepipeline-fo,"Configure Cross-Account Access for CodeCommit Repositories",Cloud
https://dzone.com/articles/how-to-build-real-time-notification-service-using,"How to Build Real-Time Notification Service Using Server-Sent Events (SSE)",Cloud
https://dzone.com/articles/do-we-really-need-a-5g-enabled-cloud-native-edge,"Do We Really Need a 5G-Enabled Cloud-Native Edge?",Cloud
https://dzone.com/articles/locking-for-multiple-nodes-the-easy-way-gcs,"Locking for Multiple Nodes the Easy Way: GCS",Cloud
https://dzone.com/articles/how-to-reduce-amazon-s3-costs,"How to Reduce Amazon S3 Costs",Cloud
https://dzone.com/articles/the-ultimate-guide-to-aws-step-functions,"The Ultimate Guide to AWS Step Functions",Cloud
https://dzone.com/articles/how-to-protect-yourself-from-unexpectedly-high-aws,"How To Protect Yourself From Unexpectedly High AWS Bills",Cloud
https://dzone.com/articles/minions-in-minikube-a-kubernetes-intro-for-java-de,"Minions in Minikube - A Kubernetes Intro for Java Developers",Cloud
https://dzone.com/articles/sending-files-between-computers-in-21st-century,"Sending Files Between Computers in the 21st Century",Cloud
https://dzone.com/articles/kubernetes-1,"Kubernetes — Replication, and Self-Healing",Cloud
https://dzone.com/articles/how-to-run-selenium-bdd-tests-in-parallel-with-aws-1,"How to Run Selenium BDD Tests in Parallel With AWS Lambda",Cloud
https://dzone.com/articles/the-mic-drop-on-fast-file-migration-speed,"The “Mic Drop” On Fast File Migration Speed",Cloud
https://dzone.com/articles/best-practices-for-executing-successful-cloud-migr,"Best Practices for Executing Successful Cloud Migration Strategy",Cloud
https://dzone.com/articles/free-kubernetes-resources,"Free Resources: Kubernetes &amp; Containers",Cloud
https://dzone.com/articles/kubernetes-dashboard-webui,"Kubernetes Dashboard WebUI",Cloud
https://dzone.com/articles/6-incredible-ides-that-can-be-managed-seamlessly-o,"6 Incredible IDEs that Can Be Managed Seamlessly Over the Cloud",Cloud
https://dzone.com/articles/top-gui-for-docker,"Top GUI for Docker",Cloud
https://dzone.com/articles/10-minute-builds-serverless-docker-with-a-simple-c,"10-Minute Builds: Serverless Docker With a Simple CI/CD Pipeline",Cloud
https://dzone.com/articles/document-versioning-with-azure-blob-storage,"Document Versioning With Azure Blob Storage",Cloud
https://dzone.com/articles/codeready-containers-getting-started-with-openshif-1,"CodeReady Containers - Getting Started with OpenShift 4.5 and Process...",Cloud
https://dzone.com/articles/untangling-sap-for-serverless-deployment,"Untangling SAP for Serverless Deployment",Cloud
https://dzone.com/articles/going-serverless-with-oracle-stored-procedures,"Going Serverless With Oracle Stored Procedures",Cloud
https://dzone.com/articles/azure-spring-cloud-a-comprehensive-overview,"Azure Spring Cloud: A Comprehensive Overview",Cloud
https://dzone.com/articles/creating-test-kubernetes-clusters-with-kind,"Creating Test Kubernetes Clusters With Kind",Cloud
https://dzone.com/articles/generating-dynamic-open-graph-images-with-azure-fu,"Generating Dynamic Open Graph Images With Azure Functions",Cloud
https://dzone.com/articles/configuring-bare-metal-vultr-servers-with-cloud-in,"Configuring Bare Metal Vultr Servers With Cloud-init",Cloud
https://dzone.com/articles/5-common-myths-debunked-hybrid-vs-native,"5 Common Myths Debunked: Hybrid Vs Native",Cloud
https://dzone.com/articles/maximize-your-google-cloud-investment-with-redis-e-1,"Maximize Your Google Cloud Investment With Redis Enterprise",Cloud
https://dzone.com/articles/introduction-to-kubernetes-security-container-secu,"Introduction to Kubernetes Security: Container Security",Cloud
https://dzone.com/articles/trusted-repositories-and-container-registries-in-k,"Trusted Repositories and Container Registries in Kubernetes",Cloud
https://dzone.com/articles/codeready-containers-getting-started-with-openshif,"CodeReady Containers - Getting Started with OpenShift 4.5 and Decision...",Cloud
https://dzone.com/articles/reasons-why-you-should-get-a-cloud-computing-certi,"Reasons Why You Should Get a Cloud Computing Certification",Cloud
https://dzone.com/articles/configure-kubernetes-network-with-flannel,"Configure Kubernetes Network With Flannel",Cloud
https://dzone.com/articles/6-easy-ways-to-manage-and-harden-vm-images-in-azur,"6 Easy Ways to Manage and Harden VM Images in Azure",Cloud
https://dzone.com/articles/cicd-using-google-cloud-build-and-google-cloud-run-1,"CI/CD Using Google Cloud Build and Google Cloud Run — Part 2",Cloud
https://dzone.com/articles/terraform-vs-yaml-deployment-for-eks-server,"Terraform vs. YAML Deployment for Kubernetes Objects",Cloud
https://dzone.com/articles/practical-serverless-long-running-workflows-with-h,"Practical Serverless: Long-Running Workflows With Human Interactions Using...",Cloud
https://dzone.com/articles/2020-and-the-cloud-top-trends-for-industry-owners-1,"2020 and the Cloud: Top Trends For Industry Owners",Cloud
https://dzone.com/articles/minimal-dev-environment-vs-code-docker,"Minimal Dev Environment: VS Code + Docker",Cloud
https://dzone.com/articles/trapping-hackers-with-containerized-deception,"Trapping Hackers With Containerized Deception",Cloud
https://dzone.com/articles/securing-remote-work-with-the-cloud,"Securing Remote Work With the Cloud",Cloud
https://dzone.com/articles/exploring-ingress-v1-graduating-to-ga-in-kubernete,"Exploring Ingress V1, Graduating to GA in Kubernetes 1.19",Cloud
https://dzone.com/articles/write-kubernetes-native-application-using-camel-k,"Write Kubernetes Native Application Using Camel K: Part 1",Cloud
https://dzone.com/articles/should-you-use-privileged-containers,"Should You Use Privileged Containers?",Cloud
https://dzone.com/articles/fast-deploy-nebula-graph-cluster-with-docker-swarm,"Fast Deploy Nebula Graph Cluster With Docker Swarm",Cloud
https://dzone.com/articles/introduction-to-kudo-automate-day-2-operations-ii,"Introduction to KUDO: Automate Day-2 Operations (II)",Cloud
https://dzone.com/articles/dynamic-admission-control-in-aks-with-azure-functi,"Dynamic Admission Control in AKS with Azure Functions",Cloud
https://dzone.com/articles/enable-tls-on-http-triggered-function-app-in-kuber,"Enable TLS on HTTP Triggered Function App in Kubernetes With KEDA and NGINX",Cloud
https://dzone.com/articles/how-to-setup-openshift-container-platform-45-on-yo,"How to setup OpenShift Container Platform 4.5 on your local machine in...",Cloud
https://dzone.com/articles/getting-started-with-windows-containers,"Getting Started With Windows Containers",Cloud
https://dzone.com/articles/micronaut-build-for-next-wave-of-microservices-amp,"Microservice and Serverless With Micronaut + GraalVM",Cloud
https://dzone.com/articles/introduction-to-kudo-automate-day-2-operations-i,"Introduction to KUDO: Automate Day-2 Operations (I)",Cloud
https://dzone.com/articles/the-complete-aws-lambda-handbook-for-beginners-par-1,"The Complete AWS Lambda Handbook for Beginners (Part 2)",Cloud
https://dzone.com/articles/the-complete-aws-lambda-handbook-for-beginners-par,"The Complete AWS Lambda Handbook for Beginners (Part 1)",Cloud
https://dzone.com/articles/top-4-post-cloud-migration-risks-to-look-for,"Top 4 Post Cloud Migration Risks to Look For",Cloud
https://dzone.com/articles/jakarta-ee-amp-wildfly-running-on-kubernetes,"Jakarta EE &amp; Wildfly Running on Kubernetes",Cloud
https://dzone.com/articles/cicd-using-google-cloud-build-and-google-cloud-run,"CI/CD Using Google Cloud Build and Google Cloud Run — Part 1",Cloud
https://dzone.com/articles/kubernetes-docker-secret-deployment-with-terraform,"Kubernetes Docker Secret Deployment With Terraform",Cloud
https://dzone.com/articles/serverless-asterisk-with-docker-and-aws-fargate,"Serverless Asterisk with Docker and AWS Fargate",Cloud
https://dzone.com/articles/the-ultimate-guide-to-monitoring-serverless-applic,"The Ultimate Guide to Monitoring Serverless Applications",Cloud
https://dzone.com/articles/converting-a-kubernetes-fullstack-application-to-h,"Converting a Kubernetes Fullstack Application to Heroku Containers",Cloud
https://dzone.com/articles/serverless-computing-vs-containers-how-to-choose-1,"Serverless Computing vs Containers: How to Choose",Cloud
https://dzone.com/articles/cloud-native-standpoint-landscape-and-best-practic,"Cloud-Native Landscape and Best Practices",Cloud
https://dzone.com/articles/aws-basics-why-do-we-need-regions-and-availability,"Why Do We Need Regions and Availability Zones?",Cloud
https://dzone.com/articles/running-sonarqube-in-ibm-kubernetes-service-iks-on,"Running SonarQube in IBM Kubernetes Service (IKS) on IBM Cloud",Cloud
https://dzone.com/articles/event-based-data-warehousing-with-azure-event-hubs,"Event-Based Data Warehousing with Azure Event Hubs and Logic Apps",Cloud
https://dzone.com/articles/how-to-build-a-superb-go-to-market-strategy-for-sa,"How To Build a Superb Go-To-Market Strategy for SaaS Startups [With Use...",Cloud
https://dzone.com/articles/aws-cost-allocation-tags-and-cost-reduction,"AWS Cost Allocation Tags and Cost Reduction",Cloud
https://dzone.com/articles/optimize-aws-landing-zone,"Optimize AWS Landing Zone",Cloud
https://dzone.com/articles/devconfus-2020-appdev-amp-containerization-and-ask,"DevConf.US 2020 - AppDev &amp; Containerization and Ask the Experts Panels",Cloud
https://dzone.com/articles/write-your-first-aws-lambda-in-java,"Write Your First AWS Lambda in Java",Cloud
https://dzone.com/articles/testing-azure-functions-on-azure-devops,"Testing Azure Functions on Azure DevOps",Cloud
https://dzone.com/articles/what-is-saas-business-model,"What Is SaaS Business Model?",Cloud
https://dzone.com/articles/single-tenant-vs-multi-tenant-saas-architecture,"Single-Tenant vs Multi-Tenant: SaaS Architecture",Cloud
https://dzone.com/articles/how-to-build-a-kubernetes-operator,"How to Build a Kubernetes Operator",Cloud
https://dzone.com/articles/kubernetes-cloud-autoscalar-in-terraform,"Kubernetes Cloud Autoscalar in Terraform - Part 1",Cloud
https://dzone.com/articles/developing-software-for-connected-cars-common-chal,"Developing Software for Connected Cars – Common Challenges and How to...",Cloud
https://dzone.com/articles/why-you-should-never-ever-print-in-a-lambda-functi,"Why You Should Never, Ever print() in a Lambda Function",Cloud
https://dzone.com/articles/survey-reveals-covid-19-driving-cloud-adoption,"Survey Reveals COVID-19 Driving Cloud Adoption",Cloud
https://dzone.com/articles/getting-started-with-azure-event-grid-viewer,"Getting Started With Azure Event Grid Viewer",Cloud
https://dzone.com/articles/serverless-for-enterprises-scale-big-or-go-home,"Serverless for Enterprises: Scale Big or Go Home",Cloud
https://dzone.com/articles/efk-stack-on-kubernetes-part-1,"EFK Stack on Kubernetes (Part 1)",Cloud
https://dzone.com/articles/monitor-your-containers-with-csysdig,"Monitor Your Containers With Csysdig",Cloud
https://dzone.com/articles/efk-stack-on-kubernetes-part-2,"EFK Stack on Kubernetes (Part 2)",Cloud
https://dzone.com/articles/why-getting-aws-certification-is-significant,"Why Getting an AWS Certification Is Significant?",Cloud
https://dzone.com/articles/no-code-incident-management-system-with-azure-logi,"No Code Incident Management System with Azure Logic Apps",Cloud
https://dzone.com/articles/5-rules-of-cloud-practices,"5 Rules of Cloud Practices",Cloud
https://dzone.com/articles/a-complete-guide-for-integrating-aws-amplify-to-re,"A Complete Guide for Integrating AWS Amplify to React Native",Cloud
